ID,Module_ID,Content_Order,Message_Type,Text,Title,Subtitle,ImageURL,LinkURL,Embed_ID,Type,Skill,Questions,AnswerOptions,RightAnswer,Right_Ans_Response,Wrong_Ans_Response
1,,,Button,,11 Essential Non-Technical Product Management Skills,"Like a CEO, a PM must also master non-technical - but no less challenging - skills in order to ensure their product's (and company's) success.",non-technical-product-management-skills-1366x683-1.jpg,http://community.uservoice.com/blog/non-technical-product-management-skills/,,WebPage,Product_Market_Fit,Which one of these is not an essential product management skill,1:Business Acumen|2:Persuasion|3:General fitness,3,,
2,,,Button,,The Top 5 Technical Skills Every Product Manager Should Know,You are kind of the mini-CEO - with all of the responsibility?but without any of the authority,software-team-sport-climbing-800x518-768x497.jpg,http://community.uservoice.com/blog/technical-skills-every-product-manager-should-know/,,WebPage,Product_Market_Fit,Which of these is not an Technical Skill needed for Product Managers,1:DataAnalysis|2:Java|3:AB Testing,2,,
3,,,Button,,Managing Cross-Functional Teams,Cross-functional teams are significantly different from teams that are aligned on one functional level.  ,24_VR_1927889_Garry_2x1.jpg,https://www.mindtools.com/pages/article/newTMM_30.htm,,WebPage,Product_Market_Fit,Which of these is essential for Cross Functional Teams,1:Clear Communication|2:Direct Reporting|3:Same Geography,1,,
4,,,Button,,Minimize Your time to Product Market fit,Product market fit is a key ask for good product managers,car.png,http://andrewchen.co/ttpmf-time-to-product-market-fit/,,WebPage,Product_Market_Fit,Reducing TTPMF is essential for startup,1:Yes|2:No|3:I dont know,1,,
5,,,Button,,How To Use 10 Psychological Theories To Persuade People,Influence your audience without feeling sleazy about it with these tips on social media.,3030173-poster-p-1-3030173-work-smart-how-to-use-10-psychological-theories-to-persuade-people.jpg,https://www.fastcompany.com/3030173/work-smart/how-to-use-10-psychological-theories-to-persuade-people,,WebPage,Product_Market_Fit,Which of these is not a psychological theory of persuasion,1:Amplification hyp|2:Priming|3:Field Sales,1,,
6,,,Button,,Can Counter Experience Bias,"Product management can seem like a solitary journey at times, as you are the only person 100% focused on the fate of a particular product or feature.",product-management-experience-bias-communication-750x400.jpg,https://community.uservoice.com/blog/product-managers-counter-experience-bias/,,WebPage,Product_Market_Fit,Which of these is a method to counter experience bias,1:Customer feedback|2:Anologies|3:Reading up,1,,
7,,,Button,,How to Onboard Junior Product Managers for Success,"It would be easy to view these new product managers as a distraction from your own daily grind, or even as competition, but this short-sighted view doesn't do anyone any favors",onboarding-junior-product-manager-1.jpg,https://community.uservoice.com/blog/onboarding-junior-product-managers/,,WebPage,Product_Market_Fit,Which of these is a not method to onboard junior members,1:Customer Interaction|2:Theory|3:Take long walks,2,,
9,,,Button,,Building an Effective Team,"Everyone brings unique talents and strengths to the table, no-one is playing politics or bickering, and there's just enough competitive spirit to bring out the best in everyone. ",onboarding-junior-product-manager-1.jpg,https://www.mindtools.com/pages/article/building-effective-teams.htm,,WebPage,Product_Market_Fit,To build an effective team you do not have to,1:Analyze and Plan|2:Get the right people|3:theorize,3,,
11,,,Button,,Alan Chiu: Nailing Product-Market Fit,Takeaways from the Stanford Graduate School of Business Entrepreneur Symposium 2015.,https://i.ytimg.com/vi/4hpP88Z16KM/hqdefault.jpg,https://www.youtube.com/watch?v=4hpP88Z16KM,4hpP88Z16KM,YouTube,Product_Market_Fit,Why focus on customer early on,1:Right Solution|2:Early sales|3:Marketing,3,,
12,,,Button,,Tools for Entrepreneurs: Finding Product Market Fit,"Google for Entrepreneurs and General Assembly have partnered up to create ""Tools for Entrepreneurs,"" video classes for entrepreneurs to grow their skills and grow their businesses. ",https://i.ytimg.com/vi/c-ruOFVG078/hqdefault.jpg,https://www.youtube.com/watch?v=c-ruOFVG078,c-ruOFVG078,YouTube,Product_Market_Fit,Instagram found product market fit ,1:Early|2:Mid|3:Later,1,,
13,,,Button,,"Dan Olsen, A Playbook for Achieving Product-Market Fit, LSC15","Everyone working on a new product is trying to achieve the same goal: product-market fit. Although product-market fit is one of the most important Lean Startup concepts, it’s also the least well defined. Dan ",https://i.ytimg.com/vi/vMu85j3E6oI/hqdefault.jpg,https://www.youtube.com/watch?v=vMu85j3E6oI,vMu85j3E6oI,YouTube,Product_Market_Fit,"In the pyramid model , which of these are not part of the process",1:Market|2:Hypothesize|3:Test,2,,
14,,,Button,,Ash Maurya - 10 Steps to Product / Market Fit - Pioneers Festival 2012,,https://i.ytimg.com/vi/Nhl5nzUNQCA/hqdefault.jpg,https://www.youtube.com/watch?v=Nhl5nzUNQCA,Nhl5nzUNQCA,YouTube,Product_Market_Fit,What percentage of companies drastically change original plan,1:One Third|2:Two Third |3:All,2,,
15,,,Button,,Marc Andreessen: Product Vs. Business,"The Business Insider presents Innovation: a series of interviews with today's most innovative business leaders, sponsored by Mercedes-Benz. Marc Andreessen,",https://i.ytimg.com/vi/zfOsP3PmI1U/hqdefault.jpg,https://www.youtube.com/watch?v=zfOsP3PmI1U,zfOsP3PmI1U,YouTube,Product_Market_Fit,When do you know a product has achieve product market fit,1:Market asks for product|2:Marketing required |3:Not Sure,2,,
16,,,Button,,10 Steps to Product-Market Fit,"Product/Market Fit is first significant milestone that matters. But while we know what Product/Market Fit should feel like, we don't quite know how to get there. ",https://i.ytimg.com/vi/1Ge_bb8JJ90/hqdefault.jpg,https://www.youtube.com/watch?v=1Ge_bb8JJ90,1Ge_bb8JJ90,YouTube,Product_Market_Fit,Start with a one page business plan,1:Yes|2:No|3:Maybe,1,,
17,,,Button,,Startup Workshop #1: Product-Market-Fit,"The hunt for finding product/market fit in an early-stage startup is an elusive one, often fraught with chaos, and certainly never easy.",https://i.ytimg.com/vi/F9aG_8CwSMM/hqdefault.jpg,https://www.youtube.com/watch?v=F9aG_8CwSMM,F9aG_8CwSMM,YouTube,Product_Market_Fit,Product market fit is the holy grail of startups,1:Yes|2:No|3:Maybe,3,,
19,,,Button,,The Three Fatal traps between MVP and Product-Market Fit by Matt Clifford,"Matt (@matthewclifford) is co-founder and CEO of Entrepreneur First, Europe's leading accelerator for technical founders.",https://i.ytimg.com/vi/19G99_sWApI/hqdefault.jpg,https://www.youtube.com/watch?v=19G99_sWApI,19G99_sWApI,YouTube,Product_Market_Fit,Premature scaling is good,1:Yes|2:No|3:Maybe,2,,
21,,,Button,,Startup Workshop #1: Product-Market-Fit,What is Product/Market Fit? Why is it the Holy Grail of entrepreneurship?,https://i.ytimg.com/vi/F9aG_8CwSMM/hqdefault.jpg,https://www.youtube.com/watch?v=F9aG_8CwSMM,F9aG_8CwSMM,YouTube,Product_Market_Fit,Product market fit is the right product at the right ime,1:Yes|2:No|3:Maybe,1,,
22,,,Button,,"How to Get to Product/Market Fit - by Côme Courteault, Growth Hacker at TheFamily",,https://i.ytimg.com/vi/DZ9Ri75eyo0/hqdefault.jpg,https://www.youtube.com/watch?v=DZ9Ri75eyo0,DZ9Ri75eyo0,YouTube,Product_Market_Fit,Did you read this content,1:Yes|2:No|3:Maybe,1,,
23,,,Button,,Do You Have Product Market Fit? It's All About Retention,Startup growth isn't just about driving users through your funnel. You need retention if you want your startup to survive.,https://i.ytimg.com/vi/bpnYFG1-rdk/hqdefault.jpg,https://www.youtube.com/watch?v=bpnYFG1-rdk,bpnYFG1-rdk,YouTube,Product_Market_Fit,Did you read this content,1:Yes|2:No|3:Maybe,1,,
24,,,Button,,Growth Hacking Demystified: Product/Market Fit,What is Growth Hacking? How can you take some many great concepts from growth hackers and growth hacking and apply them into your business? Watch the video and find out!,https://i.ytimg.com/vi/wBQefhothZQ/hqdefault.jpg,https://www.youtube.com/watch?v=wBQefhothZQ,wBQefhothZQ,YouTube,Product_Market_Fit,Did you read this content,1:Yes|2:No|3:Maybe,1,,
25,,,Button,,"Another perspective on SCRUM
",A light hearted look at what implementing SCRUM means for an organization - from the perspective of a Product Management team.,https://i.ytimg.com/vi/Sygm9x9sBEo/hqdefault.jpg,https://www.youtube.com/watch?v=Sygm9x9sBEo,Sygm9x9sBEo,YouTube,Product Management,Did you read this content,1:Yes|2:No|3:Maybe,1,,
26,,,Button,,Something,Something Else,https://i.ytimg.com/vi/orrzWddJzV0/hqdefault.jpg,https://www.youtube.com/watch?v=orrzWddJzV0,orrzWddJzV0,YouTube,Product Management,Did you read this content,1:Yes|2:No|3:Maybe,1,,
27,,,Button,,Google Ventures workshop: Lean product management,"Google Ventures Startup Lab | What is Lean Product Management? Dan Olsen, a startup veteran and leading PM voice, d",https://i.ytimg.com/vi/mIBccpqUcgY/hqdefault.jpg,https://www.youtube.com/watch?v=mIBccpqUcgY,mIBccpqUcgY,YouTube,Product Management,Did you read this content,1:Yes|2:No|3:Maybe,1,,
28,,,Button,,The Expert (Short Comedy Sketch),"Funny business meeting illustrating how hard it is for an engineer to fit into the corporate world! Starring: Orion Lee, James Marlowe, Abdiel LeRoy, Ewa Wojcik, Tatjana Sendzimir.",https://i.ytimg.com/vi/BKorP55Aqvg/hqdefault.jpg,https://www.youtube.com/watch?v=BKorP55Aqvg,BKorP55Aqvg,YouTube,Product Management,Did you read this content,1:Yes|2:No|3:Maybe,1,,
29,,,Button,,The Future of Product Management — Janice Fraser,"This is a thought piece and call to action for product managers in the software industry. In this talk, Janice leverages principles from Lean Startup, Agile, a",https://i.ytimg.com/vi/f116MblyZbQ/hqdefault.jpg,https://www.youtube.com/watch?v=f116MblyZbQ,f116MblyZbQ,YouTube,Product Management,Did you read this content,1:Yes|2:No|3:Maybe,1,,
30,,,Button,,HOW TO BE MORE INFLUENTIAL," INVISIBLE INFLUENCE BY JONAH BERGER, PhD",https://i.ytimg.com/vi/qR1znZ1rnPc/hqdefault.jpg,https://www.youtube.com/watch?v=qR1znZ1rnPc,qR1znZ1rnPc,YouTube,Personality_Development,Did you read this content,1:Yes|2:No|3:Maybe,1,,
31,,,Button,,HOW TO BE LESS STUPID,HOW TO BE LESS STUPID - EPISODE 2 - LOGICAL FALLACIES,https://i.ytimg.com/vi/ZY7Ww5924/hqdefault.jpg,https://www.youtube.com/watch?v=ZY7Ww5924,ZY7Ww5924,YouTube,Personality_Development,Did you read this content,1:Yes|2:No|3:Maybe,1,,
32,,,Button,,HOW TO BE LESS STUPID,EPISODE 1 - LOGICAL FALLACIES,https://i.ytimg.com/vi/JG1900XhKs0/hqdefault.jpg,https://www.youtube.com/watch?v=JG1900XhKs0,JG1900XhKs0,YouTube,Personality_Development,Did you read this content,1:Yes|2:No|3:Maybe,1,,
33,,,Button,,EGO IS THE ENEMY,BY RYAN HOLIDAY,https://i.ytimg.com/vi/aDsHnNc3sC4/hqdefault.jpg,https://www.youtube.com/watch?v=aDsHnNc3sC4,aDsHnNc3sC4,YouTube,Personality_Development,Did you read this content,1:Yes|2:No|3:Maybe,1,,
34,,,Button,,POSITIVE PSYCHOLOGY,"HAPPIER BY TAL BEN-SHAHAR, PhD",https://i.ytimg.com/vi/74Wei0-vAZs/hqdefault.jpg,https://www.youtube.com/watch?v=74Wei0-vAZs,74Wei0-vAZs,YouTube,Personality_Development,Did you read this content,1:Yes|2:No|3:Maybe,1,,
35,,,Button,,EVERYTHING THAT'S WRONG WITH YOUR BEHAVIOR AND WHY, THE TRUTH BY NEIL STRAUSS,https://i.ytimg.com/vi/DQA0ec39HNc/hqdefault.jpg,https://www.youtube.com/watch?v=DQA0ec39HNc,DQA0ec39HNc,YouTube,Personality_Development,Did you read this content,1:Yes|2:No|3:Maybe,1,,
36,,,Button,,HOW TO MAKE MORE THAN A HARVARD MBA,HOW TO MAKE MORE THAN A HARVARD MBA,https://i.ytimg.com/vi/SGBobDkltzo/hqdefault.jpg,https://www.youtube.com/watch?v=SGBobDkltzo,SGBobDkltzo,YouTube,Personality_Development,Did you read this content,1:Yes|2:No|3:Maybe,1,,
37,,,Button,,HOOKED: HOW TO BUILD HABIT-FORMING PRODUCTS,BY NIR EYAL ANIMATED - NARRATED BY NIR EYAL,https://i.ytimg.com/vi/hVDN2mjJpb8/hqdefault.jpg,https://www.youtube.com/watch?v=hVDN2mjJpb8,hVDN2mjJpb8,YouTube,Personality_Development,Did you read this content,1:Yes|2:No|3:Maybe,1,,
38,,,Button,,SECRETS OF THE MILLIONAIRE MIND BY T. HARV EKER ,SECRETS OF THE MILLIONAIRE MIND BY T. HARV EKER ,https://i.ytimg.com/vi/Hy00UFVyhnI/hqdefault.jpg,https://www.youtube.com/watch?v=Hy00UFVyhnI,Hy00UFVyhnI,YouTube,Personality_Development,Did you read this content,1:Yes|2:No|3:Maybe,1,,
39,,,Button,,A PRAGMATIC GUIDE TO THE POWER OF NOW BY ECKHART TOLLE ANIMATED,A PRAGMATIC GUIDE TO THE POWER OF NOW BY ECKHART TOLLE ANIMATED,https://i.ytimg.com/vi/ykmwCyHlDXM/hqdefault.jpg,https://www.youtube.com/watch?v=ykmwCyHlDXM,ykmwCyHlDXM,YouTube,Personality_Development,Did you read this content,1:Yes|2:No|3:Maybe,1,,
40,,,Button,,HOW TO HAVE MORE WILLPOWER - THE WILLPOWER INSTINCT,BY KELLY MCGONIGAL ANIMATED BOOK REVIEW,https://i.ytimg.com/vi/JH2F805BJeE/hqdefault.jpg,https://www.youtube.com/watch?v=JH2F805BJeE,JH2F805BJeE,YouTube,Personality_Development,Did you read this content,1:Yes|2:No|3:Maybe,1,,
41,,,Button,,CONTAGIOUS: WHY THINGS CATCH ON BY JONAH BERGER,CONTAGIOUS: WHY THINGS CATCH ON BY JONAH BERGER,https://i.ytimg.com/vi/HfSs_hOAkzY/hqdefault.jpg,https://www.youtube.com/watch?v=HfSs_hOAkzY,HfSs_hOAkzY,YouTube,Personality_Development,Did you read this content,1:Yes|2:No|3:Maybe,1,,
42,,,Button,,The Difference Between a Program Manager and a Project Manager,Project Management Videos,https://i.ytimg.com/vi/XyT1wzkfgok/hqdefault.jpg,https://www.youtube.com/watch?v=XyT1wzkfgok,XyT1wzkfgok,YouTube,Program_Management,Did you read this content,1:Yes|2:No|3:Maybe,1,,
43,,,Button,,"Top 10 Terms Project Managers Use
",,https://i.ytimg.com/vi/7c8xP1gRIWs/hqdefault.jpg,https://www.youtube.com/watch?v=7c8xP1gRIWs,7c8xP1gRIWs,YouTube,Program_Management,Did you read this content,1:Yes|2:No|3:Maybe,1,,
44,,,Button,,Program Management Methodology - PgMP Certification Overview,,https://i.ytimg.com/vi/jLMc-200LfU/hqdefault.jpg,https://www.youtube.com/watch?v=jLMc-200LfU,jLMc-200LfU,YouTube,Program_Management,Did you read this content,1:Yes|2:No|3:Maybe,1,,
45,,,Button,,The Basics of Good Project Management,,https://i.ytimg.com/vi/5d16JwWwjKo/hqdefault.jpg,https://www.youtube.com/watch?v=5d16JwWwjKo,5d16JwWwjKo,YouTube,Program_Management,Did you read this content,1:Yes|2:No|3:Maybe,1,,
46,,,Button,,What is Program & Project Portfolio Management?,"AIMS, UK",https://i.ytimg.com/vi/5JGvSzkzs2k/hqdefault.jpg,https://www.youtube.com/watch?v=5JGvSzkzs2k,5JGvSzkzs2k,YouTube,Program_Management,Did you read this content,1:Yes|2:No|3:Maybe,1,,
47,,,Button,,Technical Program Management at Facebook,,https://i.ytimg.com/vi/Oy853gGAysw/hqdefault.jpg,https://www.youtube.com/watch?v=Oy853gGAysw,Oy853gGAysw,YouTube,Program_Management,Did you read this content,1:Yes|2:No|3:Maybe,1,,
48,,,Button,,Top 13 Project Management Skills All Project Managers Need,,https://i.ytimg.com/vi/5Hi3t2bMN7A/hqdefault.jpg,https://www.youtube.com/watch?v=5Hi3t2bMN7A,5Hi3t2bMN7A,YouTube,Program_Management,Did you read this content,1:Yes|2:No|3:Maybe,1,,
49,,,Button,,Agile Project Management,,https://i.ytimg.com/vi/nrfl6GAQy2s/hqdefault.jpg,https://www.youtube.com/watch?v=nrfl6GAQy2s,nrfl6GAQy2s,YouTube,Program_Management,Did you read this content,1:Yes|2:No|3:Maybe,1,,
50,,,Button,,Six Metrics and KPI's for Successful Project Management,Project Management Software - Easy Projects,https://i.ytimg.com/vi/fA1qQwZ0nc4/hqdefault.jpg,https://www.youtube.com/watch?v=fA1qQwZ0nc4,fA1qQwZ0nc4,YouTube,Program_Management,Did you read this content,1:Yes|2:No|3:Maybe,1,,
51,,,Button,,Project Management Tutorial: Introduction to Project Management,Project Management Tutorial: Introduction to Project Management,https://i.ytimg.com/vi/LQmZw-HrHeo/hqdefault.jpg,https://www.youtube.com/watch?v=LQmZw-HrHeo,LQmZw-HrHeo,YouTube,Program_Management,Did you read this content,1:Yes|2:No|3:Maybe,1,,
52,,,Button,,"Project Management | Docs, Keep, Sheets, Calendar | The Apps Show","Project Management | Docs, Keep, Sheets, Calendar | The Apps Show",https://i.ytimg.com/vi/GI1htZgVfL8/hqdefault.jpg,https://www.youtube.com/watch?v=GI1htZgVfL8,GI1htZgVfL8,YouTube,Program_Management,Did you read this content,1:Yes|2:No|3:Maybe,1,,
53,,,Button,,4 Top Project Financial Management Tips - Project Management Finance,4 Top Project Financial Management Tips - Project Management Finance,https://i.ytimg.com/vi/5DybRTTvrmY/hqdefault.jpg,https://www.youtube.com/watch?v=5DybRTTvrmY,5DybRTTvrmY,YouTube,Program_Management,Did you read this content,1:Yes|2:No|3:Maybe,1,,
54,,,Button,,"How to Nail a Project Management Interview
",,https://i.ytimg.com/vi/v4zmB1fs_CQ/hqdefault.jpg,https://www.youtube.com/watch?v=v4zmB1fs_CQ,v4zmB1fs_CQ,YouTube,Program_Management,Did you read this content,1:Yes|2:No|3:Maybe,1,,
55,,,Button,,Program Management Webinar Video,,https://i.ytimg.com/vi/5i1QI7XqrYs/hqdefault.jpg,https://www.youtube.com/watch?v=5i1QI7XqrYs,5i1QI7XqrYs,YouTube,Program_Management,Did you read this content,1:Yes|2:No|3:Maybe,1,,
57,,,Button,,Harvard i-lab | Startup Secrets: Go to Market Strategies,,https://i.ytimg.com/vi/rqi-n0hA4uo/hqdefault.jpg,https://www.youtube.com/watch?v=rqi-n0hA4uo,rqi-n0hA4uo,YouTube,Go_To_Market,Did you read this content,1:Yes|2:No|3:Maybe,1,,
58,,,Button,,The 7 Essential Elements of a Killer Go-to Market Strategy,,https://i.ytimg.com/vi/d8GYM6kNy10/hqdefault.jpg,https://www.youtube.com/watch?v=d8GYM6kNy10,d8GYM6kNy10,YouTube,Go_To_Market,Did you read this content,1:Yes|2:No|3:Maybe,1,,
59,,,Button,,Steve Jobs about go to market strategy,,https://i.ytimg.com/vi/3BNGMMc3Bgc/hqdefault.jpg,https://www.youtube.com/watch?v=3BNGMMc3Bgc,3BNGMMc3Bgc,YouTube,Go_To_Market,Did you read this content,1:Yes|2:No|3:Maybe,1,,
60,,,Button,,Go-To-Market Strategy Template,,https://i.ytimg.com/vi/cwCrvY2mBW4/hqdefault.jpg,https://www.youtube.com/watch?v=cwCrvY2mBW4,cwCrvY2mBW4,YouTube,Go_To_Market,Did you read this content,1:Yes|2:No|3:Maybe,1,,
61,,,Button,,Go-To-Market Strategy - Entrepreneurship 101 2013/14,,https://i.ytimg.com/vi/bfOcaG5e4pA/hqdefault.jpg,https://www.youtube.com/watch?v=bfOcaG5e4pA,bfOcaG5e4pA,YouTube,Product_Roadmap,Did you read this content,1:Yes|2:No|3:Maybe,1,,
62,,,Button,,3 Minute Product Manager: Long-term Product Roadmaps,,https://i.ytimg.com/vi/Yu_1EgETyko/hqdefault.jpg,https://www.youtube.com/watch?v=Yu_1EgETyko,Yu_1EgETyko,YouTube,Product_Roadmap,Did you read this content,1:Yes|2:No|3:Maybe,1,,
63,,,Button,,Product Roadmaps: Creating a Compelling Vision,,https://i.ytimg.com/vi/FpYGtA3lBsI/hqdefault.jpg,https://www.youtube.com/watch?v=FpYGtA3lBsI,FpYGtA3lBsI,YouTube,Product_Roadmap,Did you read this content,1:Yes|2:No|3:Maybe,1,,
64,,,Button,,"Product Roadmap Template
",,https://i.ytimg.com/vi/0v_usBHmjT0/hqdefault.jpg,https://www.youtube.com/watch?v=0v_usBHmjT0,0v_usBHmjT0,YouTube,Product_Roadmap,Did you read this content,1:Yes|2:No|3:Maybe,1,,
65,,,Button,,"Creating, Maintaining & Prioritizing a Product Roadmap",,https://i.ytimg.com/vi/570Rg4PUO24/hqdefault.jpg,https://www.youtube.com/watch?v=570Rg4PUO24,570Rg4PUO24,YouTube,Product_Roadmap,Did you read this content,1:Yes|2:No|3:Maybe,1,,
66,,,Button,,Creating Beautiful Simple Roadmaps,,https://i.ytimg.com/vi/BuA6qQB3vUc/hqdefault.jpg,https://www.youtube.com/watch?v=BuA6qQB3vUc,BuA6qQB3vUc,YouTube,Product_Roadmap,Did you read this content,1:Yes|2:No|3:Maybe,1,,
67,,,Button,,How to Manage Cross Functional Teams,,https://i.ytimg.com/vi/PSXNzFiCd5I/hqdefault.jpg,https://www.youtube.com/watch?v=PSXNzFiCd5I,PSXNzFiCd5I,YouTube,,Did you read this content,1:Yes|2:No|3:Maybe,1,,
68,,,Button,,Challenges with Cross-functional Teams - Stanford Advanced Project Management,,https://i.ytimg.com/vi/3C-vSl7P3X4/hqdefault.jpg,https://www.youtube.com/watch?v=3C-vSl7P3X4,3C-vSl7P3X4,YouTube,Cross_Functional_Teams,Did you read this content,1:Yes|2:No|3:Maybe,1,,
69,,,Button,,Cross-Functional teams,,https://i.ytimg.com/vi/B-1pzaKzYjA/hqdefault.jpg,https://www.youtube.com/watch?v=B-1pzaKzYjA,B-1pzaKzYjA,YouTube,Cross_Functional_Teams,Did you read this content,1:Yes|2:No|3:Maybe,1,,
70,,,Button,,"Best Practice in Creating Cross-Functional Teams
",,https://i.ytimg.com/vi/iq3v3fxjHXI/hqdefault.jpg,https://www.youtube.com/watch?v=iq3v3fxjHXI,iq3v3fxjHXI,YouTube,Cross_Functional_Teams,Did you read this content,1:Yes|2:No|3:Maybe,1,,
71,,,Button,,Category Management The Cross Functional Team ,,https://i.ytimg.com/vi/MipsEiKssl4/hqdefault.jpg,https://www.youtube.com/watch?v=MipsEiKssl4,MipsEiKssl4,YouTube,Cross_Functional_Teams,Did you read this content,1:Yes|2:No|3:Maybe,1,,
72,,,Button,,How To Write A Project Specification,,https://i.ytimg.com/vi/MCXi4KtRTG0/hqdefault.jpg,https://www.youtube.com/watch?v=MCXi4KtRTG0,MCXi4KtRTG0,YouTube,Cross_Functional_Teams,Did you read this content,1:Yes|2:No|3:Maybe,1,,
73,,,Button,,Importance of Design Specifications,,https://i.ytimg.com/vi/eOckdCUOrQA/hqdefault.jpg,https://www.youtube.com/watch?v=eOckdCUOrQA,eOckdCUOrQA,YouTube,Product_Specification,Did you read this content,1:Yes|2:No|3:Maybe,1,,
74,,,Button,,Sana Commerce - Product specifications,,https://i.ytimg.com/vi/OjRwkszJsoo/hqdefault.jpg,https://www.youtube.com/watch?v=OjRwkszJsoo,OjRwkszJsoo,YouTube,Product_Specification,Did you read this content,1:Yes|2:No|3:Maybe,1,,
75,,,Button,,Product Specifications & Quality Control Checks,,https://i.ytimg.com/vi/LoZ8zMxHPIU/hqdefault.jpg,https://www.youtube.com/watch?v=LoZ8zMxHPIU,LoZ8zMxHPIU,YouTube,Product_Specification,Did you read this content,1:Yes|2:No|3:Maybe,1,,
76,1,1,Text,"Hey, {User_Name} Lets discover Product Market  Fit",,Content,Image,,,,,,,,,
77,1,2,Text,"First lets begin with Why?Lets say you have a product to offer. You are spending lots of effort in getting people to use it. People use it sometimes, But it isnt taking off. The market is not pulling the product. You have to constantly spend time/money to get people to use it",,,,,,,,Do  you think you have a problem?,1:Yes|2:No,1,"So, You don’t have a Product Market Fit","Hmm, Don’t you think there is a problem if you need to keep pushing your prdict. You will eventually run out of steam and marketing dollars. Rigjt?"
79,1,3,Text,Let us look at what an ideal situation looks like. You created a product. Customers like what they see. They  find a real need  for it . and start using your product. They may even refer others  to your product.  You see your effort in getting people to use your product Is getting lower with time. The market is pulling your product,,,,,,,,Does that feel like and Ideal situation?,1:Yes|2:No,1,"Awesome, That’s whats its like to have a product market fit. Dosent it feel  awesome? Lets see  how you can get there",
81,1,4,Text,"Lets see a definition 
""Product/market fit means being in a good market with a product that can satisfy that market.” The term was coined by Mark Anderson a popolar VC",,,,,,,,,,,,
82,1,5,Text,"Another definition is ""creating a so called minimum viable product that addresses and solves a problem or need that exists""",,,,,,,,,,,,
83,1,6,Text,So lets try some examples,,,,,,,,You know when you havent reached product market fit when,"1:Customers are buying\using your product as fast as you can make it |2:People are refeing others to your procut without  you having to ask them|3:Reporters are writing about you and calling you about your product 
D.)One or  more of the above",3,,
86,1,7,Text,One More,,,,,,,,,"1: Customers are clear about what need your product solves|2:Customers don’t come back to use your product, customer don’t talk about your  product|3: you feel like the usage slows as soon as you stop pushing your ware
",Awesome,Try Again,
87,1,8,Text,A problem/solution fit is a desire of customers for a solution to a problem. This has nothing to do with your companie's product. A product Market fit is specific to your product addressinng that need and being a solution of choise,,,,,,,,,,,,
88,1,9,Text,How do you go about finding a product market fit? ,,,,,,,,,,,,
89,1,10,Text,"According to Alan Chiu at Standford School of Business, you may not be able to controll Timing, But you can control the product and its target market",,,,,,,,,,,,
90,1,11,Text,"You can control how you define your product, what goes in and what is left out. ",,,,,,,,,,,,
91,1,12,Text,"You can also control your target market, Who you want to sell your product to. ",,,,,,,,,,,,
92,1,13,Text,"Speak with lots of customers , understand their world and discover what your market should be.  May be you will find a different pain point.",,,,,,,,,,,,
93,1,14,Text,Here are 4 aspects that you can tweak for your product market fit. Again from Alan,,,,,,,,,,,,
94,1,15,Text,User: Product designers focus on this first. What is the job your user is trying to do and what interface will help your use achieve their goal,,,,,,,,,,,,
95,1,16,Text,Application: How does your product interface with other products up stream or down stream. So your product becomes part of the users daily habit.  ,,,,,,,,,,,,
96,1,17,Text,Data : What is the mimimum about oif data you need to deliver value to the user. And how you can deliver data to the user so they can  be successful in achieving their goal with that data,,,,,,,,,,,,
97,1,18,Text,Buyer: Understand the buyers purchasing decisions. Without undertanding this you cannot optimize the product to make it easy for the buyer to buy. For example If your customers need a a trial before they can buy. Having a self  serve trial will allow lots of customers to try to product increasing the potential for  more customer to buy your product,,,,,,,,,,,,
98,1,19,Text,"Thats ut, we have coverd the basics of Prodcut Market Fit. Ho head and try it out",,,,,,,,,,,,
99,,,Text,,,,,,,,,,,,,
100,2,1,Text,Lets discover Cross Functional Team Leadership,,,,,,,,,,,,
