ID,Module_ID,Content_Order,Message_Type,Text,Title,Subtitle,ImageURL,LinkURL,Embed_ID,Type,Skill,Questions,AnswerOptions,RightAnswer,Right_Ans_Response,Wrong_Ans_Response
101,2,2,Text,Cross  Functional Team LeadershipWhat is it? It is the ability to effectively work with several teams responsible for different functions and achieve a expected result,,,,,,,,,,,,
102,2,3,Text,"So whats the big deal? Most cross functional teams don’t have a direct reporting structure , this means that you are working with teams that don’t neccessarirly report to you . You are responsible for  the out come but don’t have direct controll over the resourceses. Sounds fun:-)",,,,,,,,,,,,
103,2,4,Text,"Lets explore what you can do to become effective at leading cross functional teamsHere are the key aspects
1.) Build your team 2.) Define Responsibilites 3.) Agree on Milestones and outcome 4.) Define a communication model 5.)  Define a feedback model",,,,,,,,,,,,
104,2,5,Text,"Lets build your teamYou are  building a crossfunctional team with resources from different functions, Identify the goal and work with the key resources to difne what you need to achieve that goal. Then speak with peers to find out which resources can beft meet your nrrd",,,,,,,,,,,,
105,2,,Text,,,,,,,,,,,,,
106,2,,Text, ,,,,,,,,,,,,
107,3,,Text,"Say you are working on a product. And you need to bring together your thougts on theproduct . You need to think about the customer, the problem you are solving , how you will reach the customer etc",,,,,,,,,,,,
108,3,,Text,"How about write a business plan, or make a detaile presentation?No one reads those right!",,,,,,,,,,,,
109,3,,Text,"Further , when you are working with other people you want everyone to be on the same page. ",,,,,,,,,,,,
110,3,,Text,Having all off this on a single page can help drive clarity of thought both for you and your team.   ,,,,,,,,,,,,
111,3,,Text,"Futher , but forcing yourself to be brief, you will actually ensure you have thought about the diffent aspects ",,,,,,,,,,,,
112,3,,Text,This is what a business canvas does. It brings  together key aspects of your product approach on a single page.  ,,,,,,,,,,,,
113,3,,Text,"Here is an example of a Business Canvas , take a look",,,,,,,,,,,,
114,3,,Text,"Lets try this, Start working on your product canvas today",,,https://upload.wikimedia.org/wikipedia/commons/1/10/Business_Model_Canvas.png,,,,,,,,,
