Video_Image,Video_Author,Video_ID,Video_title,Video_Skill
https://i.ytimg.com/vi/zsm8t_YSiTs/mqdefault.jpg,VOA Learning English,zsm8t_YSiTs,Business Students Compete to Solve Global Problems,business_problems
https://i.ytimg.com/vi/Zr1UJbEHL7Y/mqdefault.jpg,Simbell channel: management consulting tools and techniques for solving business problems,Zr1UJbEHL7Y,Simbell Solve Business Problems like a Management Consultant,business_problems
https://i.ytimg.com/vi/J7XAFa4wXgY/mqdefault.jpg,TheIBMCIOStudy,J7XAFa4wXgY,CIO Business Solutions: Technology Solutions Do Not Always Solve Business Problems,business_problems
https://i.ytimg.com/vi/cou2W3wDRkE/mqdefault.jpg,New Peaks,cou2W3wDRkE,Problems vs Solutions in Business,business_problems
https://i.ytimg.com/vi/CXARKPXxFWk/mqdefault.jpg,Mariner - Your Digital Business Partner,CXARKPXxFWk,How Manufacturers Solve Business Problems using Internet of Things (IoT),business_problems
https://i.ytimg.com/vi/etbhidP3hOQ/mqdefault.jpg,DW (English),etbhidP3hOQ,Artisan coffee roasters’ supply problems | Business,business_problems
https://i.ytimg.com/vi/Nnur6yTtxuc/mqdefault.jpg,Stanford Graduate School of Business,Nnur6yTtxuc,Key Problems in Management,business_problems
https://i.ytimg.com/vi/CEzP_EAT3dg/mqdefault.jpg,Robert Jacobs,CEzP_EAT3dg,How to solve cashflow problems for small business owners,business_problems
https://i.ytimg.com/vi/nAMgV1PSVb4/mqdefault.jpg,Tosh Lubek,nAMgV1PSVb4,How To Improve Your Communication Skills and Build Good and Effective Verbal Communication Skills,Verbal_Communication
https://i.ytimg.com/vi/rFeCXxe8jpw/mqdefault.jpg,Mohsin Mumtaz,rFeCXxe8jpw,Non-verbal Communication Types & Examples.wmv,Verbal_Communication
https://i.ytimg.com/vi/I9i5_xwRE_U/mqdefault.jpg,Susan Caldwell,I9i5_xwRE_U,Verbal versus Non-verbal Communication,Verbal_Communication
https://i.ytimg.com/vi/e4hQ9FY6F8Q/mqdefault.jpg,Debashish Mitra,e4hQ9FY6F8Q,IPC- NON VERBAL COMMUNICATION,Verbal_Communication
https://i.ytimg.com/vi/SKhsavlvuao/mqdefault.jpg,Amanda Guzman,SKhsavlvuao,Non Verbal Communication,Verbal_Communication
https://i.ytimg.com/vi/ndoDQCOKXFI/mqdefault.jpg,HRCrest,ndoDQCOKXFI,Job Interview Tips - How To Improve Verbal Communication Skills | HR Crest,Verbal_Communication
https://i.ytimg.com/vi/0xsng2YOhMA/mqdefault.jpg,expertvillage,0xsng2YOhMA,Non-Verbal Communication Tools : Non-Verbal Communication: Clothing,Verbal_Communication
https://i.ytimg.com/vi/yTzS8U_IyaU/mqdefault.jpg,VisualizeMyIdeas.com,yTzS8U_IyaU,Verbal Communication Skills - Sketchnote VMI,Verbal_Communication
https://i.ytimg.com/vi/G031QFT5810/mqdefault.jpg,NationalSeminars,G031QFT5810,4 Guidelines for Good Verbal Communication,Verbal_Communication
https://i.ytimg.com/vi/nwbUy3MHZGg/mqdefault.jpg,expertvillage,nwbUy3MHZGg,Non-Verbal Communication Tools : Non-Verbal Communication: Eye Contact Avoidance,Verbal_Communication
https://i.ytimg.com/vi/eN4r8fxhUPg/mqdefault.jpg,The Sluis Academy,eN4r8fxhUPg,Non-Verbal Communication,Verbal_Communication
https://i.ytimg.com/vi/y1H2kZWjqTA/mqdefault.jpg,expertvillage,y1H2kZWjqTA,Non-Verbal Communication Tools : Non-Verbal Communication: Facial Expressions,Verbal_Communication
https://i.ytimg.com/vi/4wmyFsezeJk/mqdefault.jpg,expertvillage,4wmyFsezeJk,Non-Verbal Communication Tools : Non-Verbal Communication: Emblems,Verbal_Communication
https://i.ytimg.com/vi/5FEbfUDzNoI/mqdefault.jpg,expertvillage,5FEbfUDzNoI,Non-Verbal Communication Tools : Non-Verbal Communication: Eye Contact,Verbal_Communication
https://i.ytimg.com/vi/QMM-1ORB2GE/mqdefault.jpg,Tom Rosenthal,QMM-1ORB2GE,Tom Rosenthal - Non-Verbal Communication,Verbal_Communication
https://i.ytimg.com/vi/ZlBQxCzgRLw/mqdefault.jpg,Howcast,ZlBQxCzgRLw,Body Language Do's & Don'ts | Good Manners,Body_Language
https://i.ytimg.com/vi/gHc_qkjJqSQ/mqdefault.jpg,Casually Explained,gHc_qkjJqSQ,Casually Explained: Body Language,Body_Language
https://i.ytimg.com/vi/9fk3bmevQxo/mqdefault.jpg,Howcast,9fk3bmevQxo,How to Read Leg Movements | Body Language,Body_Language
https://i.ytimg.com/vi/_Ht6gSClAzo/mqdefault.jpg,KidInkOfficialVEVO,_Ht6gSClAzo,"Kid Ink - Body Language (Explicit) ft. Usher, Tinashe",Body_Language
https://i.ytimg.com/vi/KiDtvTEHHwU/mqdefault.jpg,JesseMcCartneyVEVO,KiDtvTEHHwU,"Jesse McCartney, T-Pain - Body Language",Body_Language
https://i.ytimg.com/vi/Nmp_-JByPaY/mqdefault.jpg,Business Insider,Nmp_-JByPaY,How To Read Body Language,Body_Language
https://i.ytimg.com/vi/k8XTgcWT7mg/mqdefault.jpg,LiveMixtapes,k8XTgcWT7mg,Jacquees - Body Language (QueMix 2),Body_Language
https://i.ytimg.com/vi/_oEmCUxiOKI/mqdefault.jpg,Benjo Pilapil,_oEmCUxiOKI,Body Language - jacquees Lyrics (Remix),Body_Language
https://i.ytimg.com/vi/nmba2B1TpTw/mqdefault.jpg,Amy North,nmba2B1TpTw,Subtle Signs He's Into You (Body Language SECRETS),Body_Language
https://i.ytimg.com/vi/TT0Yy7tyBFw/mqdefault.jpg,Howcast,TT0Yy7tyBFw,How to Read Faces for Sexual Attraction | Body Language,Body_Language
https://i.ytimg.com/vi/8kdQmd5CNN4/mqdefault.jpg,1theK (원더케이),8kdQmd5CNN4,[MV] San E(산이) _ Body Language (Feat. BUMKEY(범키)),Body_Language
https://i.ytimg.com/vi/Q3QmGwqTOS0/mqdefault.jpg,Layan Bubbly,Q3QmGwqTOS0,HOW TO SEDUCE A MAN WITH BODY LANGUAGE @LayanBubbly,Body_Language
https://i.ytimg.com/vi/CUOKDvvi40I/mqdefault.jpg,Inside Edition,CUOKDvvi40I,"Trump and Obama Lacking Eye Contact Shows Disrespect, Body Language Expert Says",Body_Language
https://i.ytimg.com/vi/zhU5QZPdZ70/mqdefault.jpg,expertvillage,zhU5QZPdZ70,How to Read Body Language : How to Flirt with Body Language,Body_Language
https://i.ytimg.com/vi/ZAP36I2Xkq8/mqdefault.jpg,CapstonePublishing,ZAP36I2Xkq8,How to read body language -- the eyes,Body_Language
https://i.ytimg.com/vi/hCxQnWCLFdE/mqdefault.jpg,AskAnnie,hCxQnWCLFdE,AskAnnie- How To Overcome Physical Barriers of Communication,Physical_Communication
https://i.ytimg.com/vi/D3a3fgUkw6c/mqdefault.jpg,TriduumLearningLabs,D3a3fgUkw6c,Communication Barriers,Physical_Communication
https://i.ytimg.com/vi/F4_luN630oU/mqdefault.jpg,Yelena Litovchenko,F4_luN630oU,""" Social Media: Effect on Physical Communication""  (creative project)",Physical_Communication
https://i.ytimg.com/vi/ab3758XWFrU/mqdefault.jpg,Jude Gabriel,ab3758XWFrU,COMMUNICATION BARRIERS,Physical_Communication
https://i.ytimg.com/vi/UrmuV2Y-n6U/mqdefault.jpg,CreativeQaiserShah,UrmuV2Y-n6U,Barriers in Communication,Physical_Communication
https://i.ytimg.com/vi/veqpXbmY9Js/mqdefault.jpg,Carter Phillips,veqpXbmY9Js,Communication Physical Therapy,Physical_Communication
https://i.ytimg.com/vi/yXfCTyJDDDk/mqdefault.jpg,Nike Football,yXfCTyJDDDk,Nike Academy: Communication and Leadership,Physical_Communication
https://i.ytimg.com/vi/lqrymRqdi5s/mqdefault.jpg,misspivotTV,lqrymRqdi5s,Miss Pivot TV - Physical Communication,Physical_Communication
https://i.ytimg.com/vi/g4oRLmKAc4k/mqdefault.jpg,improSolutions1,g4oRLmKAc4k,Fun Interactive improvisational games and exercises for better communication.,Physical_Communication
https://i.ytimg.com/vi/AkcvNSkmmTw/mqdefault.jpg,Tutorial Planet,AkcvNSkmmTw,Communication virtual machine  & Physical machine- Networking 2016 latest tech,Physical_Communication
https://i.ytimg.com/vi/SnZnZPo2JYc/mqdefault.jpg,Mauricio Delgado,SnZnZPo2JYc,TIPS TO HAVE A BALANCE BETWEEN VIRTUAL AND PHYSICAL COMMUNICATION,Physical_Communication
https://i.ytimg.com/vi/hiyLYCaZhTA/mqdefault.jpg,Brittany Smith,hiyLYCaZhTA,Psychology of Human Relations- Physical Space in Nonverbal Communication,Physical_Communication
https://i.ytimg.com/vi/PnSSZlKGmLA/mqdefault.jpg,Mike Zellers,PnSSZlKGmLA,Communication Between Physical Therapist and Patient,Physical_Communication
https://i.ytimg.com/vi/7B2DTf4Bhpw/mqdefault.jpg,Karina Hernandez,7B2DTf4Bhpw,Think Aloud for Nonverbal Communication: Physical Appearance,Physical_Communication
https://i.ytimg.com/vi/Au4Pty8k83c/mqdefault.jpg,Amy Perumalil,Au4Pty8k83c,Communication in the Physical and Occupational Therapy Field,Physical_Communication
https://i.ytimg.com/vi/Ky5p-L_m6BQ/mqdefault.jpg,How to Architect,Ky5p-L_m6BQ,How to write like an architect,Writing
https://i.ytimg.com/vi/wCzuAMVmIZ8/mqdefault.jpg,Andrew,wCzuAMVmIZ8,How to write a thesis for beginners,Writing
https://i.ytimg.com/vi/f3IFkhRTYsI/mqdefault.jpg,TheColouredScribbles,f3IFkhRTYsI,How To Write A Song - Top Ten Tips,Writing
https://i.ytimg.com/vi/pYB3u9714IQ/mqdefault.jpg,Scribble,pYB3u9714IQ,A Guide To Writing A Poem,Writing
https://i.ytimg.com/vi/SQ8faQgi6UE/mqdefault.jpg,Howcast,SQ8faQgi6UE,How to Write a Complete Sentence | Grammar Lessons,Writing
https://i.ytimg.com/vi/6K_1Vh0GT_U/mqdefault.jpg,Howcast,6K_1Vh0GT_U,How to Write a Novel,Writing
https://i.ytimg.com/vi/eGWO1ldEhtQ/mqdefault.jpg,Smrt English,eGWO1ldEhtQ,How to Write a Summary,Writing
https://i.ytimg.com/vi/0ZNSVMaPIUQ/mqdefault.jpg,FloridaInternational,0ZNSVMaPIUQ,How to Write a Short Story,Writing
https://i.ytimg.com/vi/63-mmHVfFn4/mqdefault.jpg,ElearninAcademyK5,63-mmHVfFn4,How to write numbers for children | Write Numbers 1-10 | Writing numbers for children,Writing
https://i.ytimg.com/vi/VC1Sb7IeSiM/mqdefault.jpg,CenturyBooks,VC1Sb7IeSiM,How to write a book - author Lisa Jewell's top 5 writing tips,Writing
https://i.ytimg.com/vi/-zgKOguRrRs/mqdefault.jpg,Howcast,-zgKOguRrRs,How to Write a Summary,Writing
https://i.ytimg.com/vi/tyygy2tF1IY/mqdefault.jpg,T. Michael Martin,tyygy2tF1IY,Novel Writing 101 - How to Write a Book!,Writing
https://i.ytimg.com/vi/OFWcSnRIAmc/mqdefault.jpg,sreehari sreelekha,OFWcSnRIAmc,How to Write a Story for kids,Writing
https://i.ytimg.com/vi/ZO3vzMGVA1I/mqdefault.jpg,"Write to Sell Your Book, LLC",ZO3vzMGVA1I,5 Secrets to Writing a Bestselling Novel — Secret #5: How to Write a First Draft Quickly,Writing
https://i.ytimg.com/vi/zs776GQCYmg/mqdefault.jpg,expertvillage,zs776GQCYmg,Writing Fiction & Poetry : How to Write a Novel,Writing
https://i.ytimg.com/vi/mOA8mUflH-Q/mqdefault.jpg,Sean Buvala,mOA8mUflH-Q,How To Tell A Story: Quick-Learn Storytelling Techniques!,Storytelling
https://i.ytimg.com/vi/3VbXItKXh10/mqdefault.jpg,learnstorytelling,3VbXItKXh10,Business storytelling -- How to start your story,Storytelling
https://i.ytimg.com/vi/8FGVtWhX-yQ/mqdefault.jpg,expertvillage,8FGVtWhX-yQ,How To Tell Stories: Storytelling Tips : Adding Humor to Storytelling,Storytelling
https://i.ytimg.com/vi/CI0I4DzoVLk/mqdefault.jpg,Howcast,CI0I4DzoVLk,How to Use Storytelling in a Speech | Public Speaking,Storytelling
https://i.ytimg.com/vi/Vr65K0c-nhM/mqdefault.jpg,How To Rap,Vr65K0c-nhM,How To Rap: STORYTELLING Step 3 Preview for Writer's Block Course,Storytelling
https://i.ytimg.com/vi/HX3N-92IsGU/mqdefault.jpg,Videojug,HX3N-92IsGU,How To Get Good At Storytelling,Storytelling
https://i.ytimg.com/vi/hQsla4J1Rrc/mqdefault.jpg,Sean D'Souza,hQsla4J1Rrc,Storytelling: How To Create Drama with Anticipation,Storytelling
https://i.ytimg.com/vi/HLSC5zdhA18/mqdefault.jpg,expertvillage,HLSC5zdhA18,How To Tell Stories: Storytelling Tips : Entertaining an Audience when Storytelling,Storytelling
https://i.ytimg.com/vi/-Hc9yI4Y5dM/mqdefault.jpg,expertvillage,-Hc9yI4Y5dM,How To Tell Stories: Storytelling Tips : Improving Memory Through Storytelling,Storytelling
https://i.ytimg.com/vi/1c2X8q4qB_8/mqdefault.jpg,Maker Gen,1c2X8q4qB_8,Storytelling - HOW TO YOUTUBE,Storytelling
https://i.ytimg.com/vi/OCeDPDc4Sw0/mqdefault.jpg,expertvillage,OCeDPDc4Sw0,How To Tell Stories: Storytelling Tips : Using Drawing to Remember: Storytelling Tips,Storytelling
https://i.ytimg.com/vi/dKZiXR5qUlQ/mqdefault.jpg,Jerome Gratigny,dKZiXR5qUlQ,What is Digital Storytelling?,Storytelling
https://i.ytimg.com/vi/KKFhfEI-bi4/mqdefault.jpg,expertvillage,KKFhfEI-bi4,Public Speaking Tips : How to Use Storytelling in Public Speeches,Storytelling
https://i.ytimg.com/vi/6E6saZ0zIgg/mqdefault.jpg,expertvillage,6E6saZ0zIgg,How To Tell Stories: Storytelling Tips : How Many Stories To Tell: Storytelling Tips,Storytelling
https://i.ytimg.com/vi/cyrmtWZXIqY/mqdefault.jpg,expertvillage,cyrmtWZXIqY,How To Tell Stories: Storytelling Tips : How to Tell Stories,Storytelling
https://i.ytimg.com/vi/BW_4UwSlrAk/mqdefault.jpg,Leeds College of Art,BW_4UwSlrAk,BA (Hons) Visual Communication degree,Visual_Communication
https://i.ytimg.com/vi/r7R1wD20Up0/mqdefault.jpg,MAK LIVE,r7R1wD20Up0,Visual Communication Design Definition,Visual_Communication
https://i.ytimg.com/vi/Poudrd4AYks/mqdefault.jpg,Digicast Productions,Poudrd4AYks,The Importance of Visual Communication,Visual_Communication
https://i.ytimg.com/vi/SepYoMp7StM/mqdefault.jpg,thomasburtonwriter,SepYoMp7StM,What is Visual Communication?,Visual_Communication
https://i.ytimg.com/vi/ZniyJk1RsHA/mqdefault.jpg,Hall Groat II,ZniyJk1RsHA,SUNYBroome Visual Communication Arts Associate Degree Program,Visual_Communication
https://i.ytimg.com/vi/kzVyO2MYZc4/mqdefault.jpg,Stevenson University,kzVyO2MYZc4,Visual Communication Design + Career at Stevenson University,Visual_Communication
https://i.ytimg.com/vi/OYZUOlZ87aI/mqdefault.jpg,Massey University,OYZUOlZ87aI,BDes at Massey - visual communication design | Massey University,Visual_Communication
https://i.ytimg.com/vi/an-fVAG3OHQ/mqdefault.jpg,Oscar Melendez,an-fVAG3OHQ,The Power of Visual Communications,Visual_Communication
https://i.ytimg.com/vi/-ucKNLHyM1o/mqdefault.jpg,JSU Art,-ucKNLHyM1o,Jacksonville State University MFA in Visual Communication Design,Visual_Communication
https://i.ytimg.com/vi/zceZ7SET7rA/mqdefault.jpg,WinthropDoD,zceZ7SET7rA,Winthrop University Visual Communication Design by Baker,Visual_Communication
https://i.ytimg.com/vi/vQt5h0F_LKI/mqdefault.jpg,Deakin University,vQt5h0F_LKI,Visual Communication Design at Deakin,Visual_Communication
https://i.ytimg.com/vi/gIfLfp-MznI/mqdefault.jpg,FIDM/Fashion Institute of Design & Merchandising,gIfLfp-MznI,Study Visual Communications at FIDM College,Visual_Communication
https://i.ytimg.com/vi/4yB9dTNw8Ng/mqdefault.jpg,Western Oregon University,4yB9dTNw8Ng,Visual Communication Design Major,Visual_Communication
https://i.ytimg.com/vi/g117ZhB_hRs/mqdefault.jpg,Axel Toh,g117ZhB_hRs,Introducing Visual Communication (Course),Visual_Communication
https://i.ytimg.com/vi/ZohAaNNnNqs/mqdefault.jpg,NAIT,ZohAaNNnNqs,Specialize in visual communications,Visual_Communication
https://i.ytimg.com/vi/WvT9WjSlk8E/mqdefault.jpg,Howcast,WvT9WjSlk8E,How to Use Humor in a Speech | Public Speaking,Humor
https://i.ytimg.com/vi/KyWjRy-Wnsg/mqdefault.jpg,PublicspeakKing,KyWjRy-Wnsg,How To Create Humor or Joke in a speech,Humor
https://i.ytimg.com/vi/pddKvyraTqE/mqdefault.jpg,expertvillage,pddKvyraTqE,How to Give a Funny Speech : Funny Speeches: Practice Humor,Humor
https://i.ytimg.com/vi/STSOqApow_4/mqdefault.jpg,LIVESTRONG.COM,STSOqApow_4,How to Use Humor Therapy for Stress,Humor
https://i.ytimg.com/vi/2eo4pYUjfr8/mqdefault.jpg,mr moose,2eo4pYUjfr8,How to humor with Mr moose.,Humor
https://i.ytimg.com/vi/cAfnDxiV6Jg/mqdefault.jpg,Giggle to Chuckle,cAfnDxiV6Jg,How to understand electricity just with humor. What is funny electricity,Humor
https://i.ytimg.com/vi/ohMcp3tacDc/mqdefault.jpg,Big Think,ohMcp3tacDc,"‘Hey Bill Nye, Is a Sense of Humor Exclusive to Human Beings?’ #TuesdaysWithBill",Humor
https://i.ytimg.com/vi/0P6fdCOSgNo/mqdefault.jpg,Jared Volle,0P6fdCOSgNo,How to Write Stand-Up Comedy- Keys to Observational Humor,Humor
https://i.ytimg.com/vi/UuHvuCSgsNU/mqdefault.jpg,FP360.com,UuHvuCSgsNU,"FP360 #149: How to Improve Your Sense of Humor, 3 Tips in less than 60 seconds",Humor
https://i.ytimg.com/vi/gN_1bE-r8Fw/mqdefault.jpg,expertvillage,gN_1bE-r8Fw,Public Speaking Tips : How to Use Humor in Public Speaking,Humor
https://i.ytimg.com/vi/c6CcUrV2H4o/mqdefault.jpg,How To Humor 1,c6CcUrV2H4o,How To Humor EP.1,Humor
https://i.ytimg.com/vi/XdyT_xV9e1E/mqdefault.jpg,How To Humor 1,XdyT_xV9e1E,How To Humor EP.2,Humor
https://i.ytimg.com/vi/9PpcUWBqZsc/mqdefault.jpg,Alien Moon,9PpcUWBqZsc,How to clean a computer virus(Humor),Humor
https://i.ytimg.com/vi/8FGVtWhX-yQ/mqdefault.jpg,expertvillage,8FGVtWhX-yQ,How To Tell Stories: Storytelling Tips : Adding Humor to Storytelling,Humor
https://i.ytimg.com/vi/3ub3IAtForA/mqdefault.jpg,The Hyderabadi Humor,3ub3IAtForA,The Hyderabadi Humor- how to deal with the annoying saudi return friend,Humor
https://i.ytimg.com/vi/We5zT5yjSiY/mqdefault.jpg,lemondstastegood,We5zT5yjSiY,How to be witty,Quick-wittedness
https://i.ytimg.com/vi/exNY4WSTPoI/mqdefault.jpg,RomanPhilosopher,exNY4WSTPoI,FUNNY - Quick Witted Weatherman Gets a Low Jab on the Anchorwoman,Quick-wittedness
https://i.ytimg.com/vi/YXnt7_Z0-so/mqdefault.jpg,TMZ,YXnt7_Z0-so,Christine Bentley: Quick Comebacks | TMZ,Quick-wittedness
https://i.ytimg.com/vi/CSovMyXCTaY/mqdefault.jpg,bluemoss2,CSovMyXCTaY,Friends - The One with Chandler's excellent Quick Wit!,Quick-wittedness
https://i.ytimg.com/vi/eP-6o_SM9Ck/mqdefault.jpg,zingTV,eP-6o_SM9Ck,SRK's Quick Wit At It's Best,Quick-wittedness
https://i.ytimg.com/vi/vDuU_dxh_Ow/mqdefault.jpg,Bart McLeay for US Senate,vDuU_dxh_Ow,Quick Witted Bart McLeay at GOP Senate Debate,Quick-wittedness
https://i.ytimg.com/vi/00uOHKg_aMw/mqdefault.jpg,WILTY? Nope!,00uOHKg_aMw,The quick wit of Lee Mack - Would I Lie to You? [HD][CC],Quick-wittedness
https://i.ytimg.com/vi/KVMqARpdMRw/mqdefault.jpg,HDgamingGuides,KVMqARpdMRw,Metro 2033 Quick-witted Achievement,Quick-wittedness
https://i.ytimg.com/vi/M8xjlm3V4qY/mqdefault.jpg,SDictionary,M8xjlm3V4qY,Quick-witted Meaning,Quick-wittedness
https://i.ytimg.com/vi/_G3G7DvsC5c/mqdefault.jpg,World of Warships Asia,_G3G7DvsC5c,World Of Warships - Head Over Keels: Quick-Witted Lieutenant,Quick-wittedness
https://i.ytimg.com/vi/xpFsCxEM4vE/mqdefault.jpg,elsmeghead,xpFsCxEM4vE,Me being quick witted,Quick-wittedness
https://i.ytimg.com/vi/Y-BoNv3rB5E/mqdefault.jpg,Zhakey - Guías de Trofeos / Guías de Logros,Y-BoNv3rB5E,Metro 2033 - Logro Mente despierta (Quick-witted),Quick-wittedness
https://i.ytimg.com/vi/PvFeWEixHh4/mqdefault.jpg,Lead Example,PvFeWEixHh4,Metro 2033 Quick-witted Achievement,Quick-wittedness
https://i.ytimg.com/vi/Jl3SKAvZOVY/mqdefault.jpg,BarRat99,Jl3SKAvZOVY,Simon Hobday's Quick-Witted Response,Quick-wittedness
https://i.ytimg.com/vi/EuCLqMUvTC0/mqdefault.jpg,Marjut Färman,EuCLqMUvTC0,Quick-witted Icelandic Sheepdog,Quick-wittedness
https://i.ytimg.com/vi/z_-rNd7h6z8/mqdefault.jpg,Optimal Lifestyle,z_-rNd7h6z8,Active Listening. How to be a great listener.,Listening
https://i.ytimg.com/vi/MazQLhlWBco/mqdefault.jpg,Learn Korean with GO! Billy Korean,MazQLhlWBco,How to Improve Your Korean Listening,Listening
https://i.ytimg.com/vi/tO68uTk-T_E/mqdefault.jpg,expertvillage,tO68uTk-T_E,How to Be a Good Listener : Good Listeners: Active Listening,Listening
https://i.ytimg.com/vi/z-lsHrRhJAU/mqdefault.jpg,pureMix,z-lsHrRhJAU,"Are Your Ears Fooling You? A Listening Exercise from ""How to Listen""",Listening
https://i.ytimg.com/vi/adLVNaRZIcE/mqdefault.jpg,Go Natural English,adLVNaRZIcE,How to Hear the Plural S - Improve Your English Listening Skills,Listening
https://i.ytimg.com/vi/mYKZQFwyDwM/mqdefault.jpg,Fluent in Mandarin.com,mYKZQFwyDwM,How to improve your listening ability in a foreign language,Listening
https://i.ytimg.com/vi/gTSoTBI5Uq0/mqdefault.jpg,Karen Quinn,gTSoTBI5Uq0,How to Teach Your Child Listening Skills,Listening
https://i.ytimg.com/vi/EXfVVX_G6vE/mqdefault.jpg,Leef,EXfVVX_G6vE,Leef How To - Listening to music with Leef iBridge™,Listening
https://i.ytimg.com/vi/LHkt2_yuIkA/mqdefault.jpg,Foil Arms and Hog,LHkt2_yuIkA,How to Pretend you are Listening - Foil Arms and Hog,Listening
https://i.ytimg.com/vi/CN3g96pHLEY/mqdefault.jpg,TheSource4Parents.com,CN3g96pHLEY,How to listen to your teenager [R U Listening],Listening
https://i.ytimg.com/vi/JKA9ubwMKK0/mqdefault.jpg,SocialMediaWeek,JKA9ubwMKK0,How To Sync Your Spotify Playlists For Offline Listening,Listening
https://i.ytimg.com/vi/N-RbxxA8zNU/mqdefault.jpg,Myra Golden,N-RbxxA8zNU,How to Demonstrate You Are Listening to a Customer,Listening
https://i.ytimg.com/vi/Vh5bKuhSjAs/mqdefault.jpg,Oxford University Press ELT,Vh5bKuhSjAs,How to teach listening and speaking skills with Oxford iTools (1/2),Listening
https://i.ytimg.com/vi/HujSmqk08l0/mqdefault.jpg,expertvillage,HujSmqk08l0,How to Appreciate Music : Listening to Music Actively & Passively,Listening
https://i.ytimg.com/vi/EJnLsfrRia0/mqdefault.jpg,Showme the right way,EJnLsfrRia0,How To Improve your listening skills,Listening
https://i.ytimg.com/vi/pJHXlT86rSk/mqdefault.jpg,FightMediocrity,pJHXlT86rSk,PRESENTATION SKILLS - HOW TO START A PRESENTATION OR A SPEECH,Presentation_Skills
https://i.ytimg.com/vi/bt8YFCveNpY/mqdefault.jpg,Speakfirst,bt8YFCveNpY,Presentation skills - How to improve your presentations,Presentation_Skills
https://i.ytimg.com/vi/AwAqOKZZY-A/mqdefault.jpg,Him-eesh Madaan,AwAqOKZZY-A,Public Speaking & Presentation Skills Training (Explained in Hindi),Presentation_Skills
https://i.ytimg.com/vi/r2vHYJsQP_A/mqdefault.jpg,simpleshow,r2vHYJsQP_A,How to improve presentation skills - mysimpleshow,Presentation_Skills
https://i.ytimg.com/vi/fapnvvBfvIU/mqdefault.jpg,cjmherring,fapnvvBfvIU,PRESENTATION SKILLS 1: DEATH BY POWERPOINT,Presentation_Skills
https://i.ytimg.com/vi/91aiax1ia-A/mqdefault.jpg,George Torok,91aiax1ia-A,Presentation Skills Training: How to Start Your Presentation - Pause,Presentation_Skills
https://i.ytimg.com/vi/7NgL2z0HBk4/mqdefault.jpg,Nor Asmaa' Hussein,7NgL2z0HBk4,ORAL PRESENTATION SKILLS,Presentation_Skills
https://i.ytimg.com/vi/N_SR8Sogse0/mqdefault.jpg,FocusWith Tokas,N_SR8Sogse0,"Body Language Tip - Presentation skills, Public Speaking Hindi",Presentation_Skills
https://i.ytimg.com/vi/NYVHnJlnND8/mqdefault.jpg,Power Presentations,NYVHnJlnND8,Presentation Skills Training: How to Create Effective Presentations with High Impact Introductions,Presentation_Skills
https://i.ytimg.com/vi/9_UGQYYSXQY/mqdefault.jpg,Carl Kwan,9_UGQYYSXQY,"""Presentation Skills"" How to introduce your team (CC)",Presentation_Skills
https://i.ytimg.com/vi/gqQkjYl9Dhc/mqdefault.jpg,BananaManaTV,gqQkjYl9Dhc,Ep 1. How to Prepare a Presentation - Presentation Skills - Public Speaking,Presentation_Skills
https://i.ytimg.com/vi/E3DujJ2PuEk/mqdefault.jpg,Victor Antonio,E3DujJ2PuEk,Presentation Skill - How to Present with Confidence,Presentation_Skills
https://i.ytimg.com/vi/lUTG-i4oQ10/mqdefault.jpg,Liam Lusk,lUTG-i4oQ10,Presentation Skills: 3 Effective Ways To End A Presentation,Presentation_Skills
https://i.ytimg.com/vi/S5c1susCPAE/mqdefault.jpg,Hussain Shafei,S5c1susCPAE,Presentation Good/Bad Examples,Presentation_Skills
https://i.ytimg.com/vi/_r8vikd7hhg/mqdefault.jpg,Good Vibrations Agency,_r8vikd7hhg,How to improve your presentation skills and powerpoint presentation,Presentation_Skills
https://i.ytimg.com/vi/_3fz0eiBGvA/mqdefault.jpg,Harvard Extension School,_3fz0eiBGvA,How to Overcome the Fear of Public Speaking: 3 Tips,Public_Speaking
https://i.ytimg.com/vi/qX-MaH2Jrq4/mqdefault.jpg,Brian Tracy,qX-MaH2Jrq4,How to Overcome Your Fear of Public Speaking,Public_Speaking
https://i.ytimg.com/vi/OncUwIoBbMc/mqdefault.jpg,Howcast,OncUwIoBbMc,How to Speak with Confidence | Public Speaking,Public_Speaking
https://i.ytimg.com/vi/ZK3jSXYBNak/mqdefault.jpg,Business Insider,ZK3jSXYBNak,4 essential body language tips from a world champion public speaker,Public_Speaking
https://i.ytimg.com/vi/YwdBoT-ZfdM/mqdefault.jpg,Howcast,YwdBoT-ZfdM,How to Open a Speech | Public Speaking,Public_Speaking
https://i.ytimg.com/vi/NVFtWOKQXyo/mqdefault.jpg,Tom Woods,NVFtWOKQXyo,Learn how to overcome the Fear of Public Speaking: 8 tips,Public_Speaking
https://i.ytimg.com/vi/79vuXNPO2Y0/mqdefault.jpg,Howcast,79vuXNPO2Y0,How to Prepare for a Speech | Public Speaking,Public_Speaking
https://i.ytimg.com/vi/BVIWqp7I6bE/mqdefault.jpg,Rule The Room Public Speaking,BVIWqp7I6bE,Public Speaking Tips - Overcome Your Fear,Public_Speaking
https://i.ytimg.com/vi/WkS67oiei78/mqdefault.jpg,Brian Tracy,WkS67oiei78,Public Speaking Tip  The Power of the Pause,Public_Speaking
https://i.ytimg.com/vi/WvT9WjSlk8E/mqdefault.jpg,Howcast,WvT9WjSlk8E,How to Use Humor in a Speech | Public Speaking,Public_Speaking
https://i.ytimg.com/vi/S_-HB9A6uhM/mqdefault.jpg,BuzzFeedViolet,S_-HB9A6uhM,When You're Afraid Of Public Speaking,Public_Speaking
https://i.ytimg.com/vi/wkjNIsyLnPo/mqdefault.jpg,Jill Schiefelbein,wkjNIsyLnPo,"How to Be a Good Public Speaker: The Three ""Cs"" of Speaking",Public_Speaking
https://i.ytimg.com/vi/XK1ULxSIo-k/mqdefault.jpg,Howcast,XK1ULxSIo-k,How to Speak in Front of a Big Crowd | Public Speaking,Public_Speaking
https://i.ytimg.com/vi/jgGdKAnK5vY/mqdefault.jpg,Dan Howden - ABC Speaking Skills,jgGdKAnK5vY,Public Speaking Tips- Posture - How To Stand -ABC-Speaking-Skills-Dan-HD-720p,Public_Speaking
https://i.ytimg.com/vi/IAz-grHMhTE/mqdefault.jpg,expertvillage,IAz-grHMhTE,Online Public Speaking Workshop : How to Use Hand Gestures in Public Speaking,Public_Speaking
https://i.ytimg.com/vi/SK6Q4YXZJEc/mqdefault.jpg,ebktips,SK6Q4YXZJEc,How To Interview Someone - 14 best practices,Interviewing
https://i.ytimg.com/vi/E78k_XDjFLA/mqdefault.jpg,LoquaCommunications,E78k_XDjFLA,How to act in an interview,Interviewing
https://i.ytimg.com/vi/TqKG8SnqTKs/mqdefault.jpg,Ryan Spanger,TqKG8SnqTKs,How to Interview Someone on Camera,Interviewing
https://i.ytimg.com/vi/I2IDGXX5-YY/mqdefault.jpg,The Interview Guys,I2IDGXX5-YY,Top 10 Job Interview Questions and Answers,Interviewing
https://i.ytimg.com/vi/qSylCmes5dw/mqdefault.jpg,The Interview Guys,qSylCmes5dw,Interview Tips - The Top 5 Job Interview Tips You NEED To Pay Attention To,Interviewing
https://i.ytimg.com/vi/LQayAmLz1FQ/mqdefault.jpg,Don Georgevich,LQayAmLz1FQ,What to say at the end of a job interview - How to end a job interview,Interviewing
