Video_Image,Video_Author,Video_ID,Video_title,Video_Skill
https://i.ytimg.com/vi/VVMAswJf1dc/mqdefault.jpg,PopurlsBrown,VVMAswJf1dc,Launching A New Product,launch_new_products
https://i.ytimg.com/vi/q0W_Rv6OL3o/mqdefault.jpg,Dorier Group,q0W_Rv6OL3o,Product launch | Paris | Huawei | Dorier Technical Production | MCI Event,launch_new_products
https://i.ytimg.com/vi/JDubA6y2L2o/mqdefault.jpg,Ordnance Survey,JDubA6y2L2o,Amazing new product launch,launch_new_products
https://i.ytimg.com/vi/AcxWMLEl_Cg/mqdefault.jpg,Patricia Sweeney,AcxWMLEl_Cg,"Online Business - How to launch a new product, How to market a new product",launch_new_products
https://i.ytimg.com/vi/jJwPBTM89ZY/mqdefault.jpg,Growth Technical Marketing,jJwPBTM89ZY,Steps to a Successful New Product Launch,launch_new_products
https://i.ytimg.com/vi/x_sZIJZLCHE/mqdefault.jpg,E2openTV,x_sZIJZLCHE,New Product Introduction: Launch Products Faster and More Profitably,launch_new_products
https://i.ytimg.com/vi/Zsgl4ahOkjE/mqdefault.jpg,Amway product,Zsgl4ahOkjE,Amway new product launch and offers,launch_new_products
https://i.ytimg.com/vi/Jg3JL7o21b0/mqdefault.jpg,SmartSims,Jg3JL7o21b0,How To Launch A New Product in MikesBikes-Advanced,launch_new_products
https://i.ytimg.com/vi/oon4zDd_8e4/mqdefault.jpg,AdvantisComm,oon4zDd_8e4,Product Launch Sample Video,launch_new_products
https://i.ytimg.com/vi/0EyBbefjv4A/mqdefault.jpg,JungleMediaInc,0EyBbefjv4A,New Product Launch - Marketing,launch_new_products
https://i.ytimg.com/vi/rbA4RFobaWE/mqdefault.jpg,MIUI ROM,rbA4RFobaWE,‪2014 Xiaomi New Product Launch Event: Introducing Xiaomi Mi 4,launch_new_products
https://i.ytimg.com/vi/kE-k9zYmKxM/mqdefault.jpg,Honorbuy Mobile Shop,kE-k9zYmKxM,‪2015.10.27 LeTV New Product Launch Event,launch_new_products
https://i.ytimg.com/vi/fn2ePvBq9ic/mqdefault.jpg,ProductLaunchs,fn2ePvBq9ic,New Product Launch | Need Help with your New Product Launch??,launch_new_products
https://i.ytimg.com/vi/p_L7PHeOBZo/mqdefault.jpg,VectorCentral.com,p_L7PHeOBZo,Product Launch Reviews | Best New Products On The Market,launch_new_products
https://i.ytimg.com/vi/o5B8QCE_TEQ/mqdefault.jpg,InMotionAnimation,o5B8QCE_TEQ,Teaser Video #6 New Product Launch,launch_new_products
https://i.ytimg.com/vi/kGUPSvswmY0/mqdefault.jpg,Ronkonian,kGUPSvswmY0,Software as a Service overview,Software_as_a_Service
https://i.ytimg.com/vi/zqABiwIjqPU/mqdefault.jpg,Singtel Business,zqABiwIjqPU,What is Software-as-a-Service (SaaS)?,Software_as_a_Service
https://i.ytimg.com/vi/p7wSwb4Gv20/mqdefault.jpg,HandsonERP,p7wSwb4Gv20,What is Software as a service?,Software_as_a_Service
https://i.ytimg.com/vi/H0oX-Q9F3PE/mqdefault.jpg,TheCloud_Shorts,H0oX-Q9F3PE,Software as a Service (SaaS) - Explained,Software_as_a_Service
https://i.ytimg.com/vi/KgL3BfAc9Cs/mqdefault.jpg,IntegrantSoftware,KgL3BfAc9Cs,IaaS vs. PaaS vs. SaaS,Software_as_a_Service
https://i.ytimg.com/vi/R9uSm7CB050/mqdefault.jpg,IBM Cloud Computing,R9uSm7CB050,IBM study: Software as a Service (SaaS) drives competitive advantage for top companies,Software_as_a_Service
https://i.ytimg.com/vi/xiOJMhY2lAU/mqdefault.jpg,Keith Rozario,xiOJMhY2lAU,What is cloud computing (SaaS),Software_as_a_Service
https://i.ytimg.com/vi/cBRstE_C3iQ/mqdefault.jpg,LearningHub Academy,cBRstE_C3iQ,"How Cloud Computing Works - IAAS, PAAS, SAAS explained with real examples",Software_as_a_Service
https://i.ytimg.com/vi/3DCqdY3yyDE/mqdefault.jpg,redmccombs,3DCqdY3yyDE,SaaS - Software as a Service,Software_as_a_Service
https://i.ytimg.com/vi/sLFsUrQwSq0/mqdefault.jpg,Nagaraju Yajjuvarapu,sLFsUrQwSq0,cloud computing lesson3 Software as a Service SaaS,Software_as_a_Service
https://i.ytimg.com/vi/4B8_6L7dIXQ/mqdefault.jpg,PwC US,4B8_6L7dIXQ,Software as a Service is driving industry disruption,Software_as_a_Service
https://i.ytimg.com/vi/URdNFcV0xCQ/mqdefault.jpg,ekarthaweb123,URdNFcV0xCQ,Ekartha: Introduction to SaaS(Software as a Service),Software_as_a_Service
https://i.ytimg.com/vi/hVyqKq8leZ4/mqdefault.jpg,IDEALINVENT,hVyqKq8leZ4,Banking Software as a Service - B-SaaS,Software_as_a_Service
https://i.ytimg.com/vi/-oF-lM5PWLY/mqdefault.jpg,Disruptware LIVE,-oF-lM5PWLY,What is SaaS And Why Is It A Great Business Model,Software_as_a_Service
https://i.ytimg.com/vi/yAZ3DrWK2vM/mqdefault.jpg,HylandSoftware,yAZ3DrWK2vM,"Basics of Software as a Service, or SaaS, in less than three minutes",Software_as_a_Service
https://i.ytimg.com/vi/tjQFtSmVppY/mqdefault.jpg,Howcast,tjQFtSmVppY,How to Conduct a Market Research Survey,market_research
https://i.ytimg.com/vi/BL4e48iQV5U/mqdefault.jpg,BigCommerce,BL4e48iQV5U,Small Business Boot Camp: 8 ways to conduct market research for your Ecommerce Idea,market_research
https://i.ytimg.com/vi/p7Nv16FppOE/mqdefault.jpg,SmallBusinessBC,p7Nv16FppOE,Understanding Market Research for Small Business,market_research
https://i.ytimg.com/vi/TsOgNmeeQHo/mqdefault.jpg,CareerRx,TsOgNmeeQHo,A Day in the Life - Market Research Analyst,market_research
https://i.ytimg.com/vi/cjk0dbB0uMw/mqdefault.jpg,eHow,cjk0dbB0uMw,Marketing Plans : How to Conduct Market Research,market_research
https://i.ytimg.com/vi/QlRgywPFBNM/mqdefault.jpg,Patrick Dixon Futurist Keynote Speaker for Industry Conference,QlRgywPFBNM,"Market research - how to get better results: customer insight, consumer trends - Marketing Keynote",market_research
https://i.ytimg.com/vi/1Fja06iCIE0/mqdefault.jpg,Square One: Saskatchewan's Business Resource Centre,1Fja06iCIE0,Why Market Research is Important,market_research
https://i.ytimg.com/vi/mHuYiKoDxFY/mqdefault.jpg,MShop NYC,mHuYiKoDxFY,Market Research | How to  Start Your Fashion Company®,market_research
https://i.ytimg.com/vi/cIxaPMSIoZ8/mqdefault.jpg,Research,cIxaPMSIoZ8,How to do Market Research - Best Marketing Research Strategies,market_research
https://i.ytimg.com/vi/F1Y0CYOIWIQ/mqdefault.jpg,Business Wales/Busnes Cymru,F1Y0CYOIWIQ,Types of market research,market_research
https://i.ytimg.com/vi/_ZM3trrKrYY/mqdefault.jpg,eHow,_ZM3trrKrYY,Business Marketing & Design : How to Write a Marketing Research Proposal,market_research
https://i.ytimg.com/vi/GRVMUroE2Ok/mqdefault.jpg,CareerBuilder,GRVMUroE2Ok,CareerBuilder Top Jobs of 2013: Market Research Analyst,market_research
https://i.ytimg.com/vi/psLF7CcR7ic/mqdefault.jpg,eHow,psLF7CcR7ic,Marketing Plans : How to Conduct Your Own Market Research,market_research
https://i.ytimg.com/vi/2U3w5Blv0Lg/mqdefault.jpg,Christopher Zobrist,2U3w5Blv0Lg,Steve Jobs on Market Research m4v ff avi ff,market_research
https://i.ytimg.com/vi/NpvOe7Foc8U/mqdefault.jpg,GfK,NpvOe7Foc8U,GfK - A life without market research #LifeWithoutMarketResearch,market_research
https://i.ytimg.com/vi/BmrtXYWMuLg/mqdefault.jpg,Knoa Software,BmrtXYWMuLg,SAP User Experience Management by Knoa,User_Experience_Management
https://i.ytimg.com/vi/o6J-0-X4dTA/mqdefault.jpg,industryanalyst2012,o6J-0-X4dTA,Knoa User Experience Management 2 Minute Explainer:  User Experience Monitoring,User_Experience_Management
https://i.ytimg.com/vi/TfE6NrV81kA/mqdefault.jpg,industryanalyst2012,TfE6NrV81kA,Knoa EPM User Experience Management Monitoring 90 Second Explainer,User_Experience_Management
https://i.ytimg.com/vi/ohGCslX2LvE/mqdefault.jpg,Dynatrace,ohGCslX2LvE,Quick Overview: Dynatrace AppMon & UEM 6.3,User_Experience_Management
https://i.ytimg.com/vi/0hEw3yBVusY/mqdefault.jpg,amasol AG,0hEw3yBVusY,End User Experience Management in zwei Minuten einfach erklärt,User_Experience_Management
https://i.ytimg.com/vi/bIONMU3iZVs/mqdefault.jpg,SAPEducation,bIONMU3iZVs,DULUX Group Runs SAP User Experience Management by Knoa,User_Experience_Management
https://i.ytimg.com/vi/9zNnCwBfF_I/mqdefault.jpg,SAPEducation,9zNnCwBfF_I,SAP Education User Experience Management by Knoa,User_Experience_Management
https://i.ytimg.com/vi/-XSFnXBn-UQ/mqdefault.jpg,Knoa Software,-XSFnXBn-UQ,What is User Experience Management by Knoa?,User_Experience_Management
https://i.ytimg.com/vi/XPiOCK0JOlU/mqdefault.jpg,oracleusableapps,XPiOCK0JOlU,Evolution Of User Experience,User_Experience_Management
https://i.ytimg.com/vi/Be2oAIbH578/mqdefault.jpg,HPE Technology,Be2oAIbH578,HPE 3PAR StoreServ Management Console - Simplifying the user experience,User_Experience_Management
https://i.ytimg.com/vi/xNF9o1qtSwY/mqdefault.jpg,Dell Software - now a part of Quest,xNF9o1qtSwY,Beyond web analytics with Foglight User Experience Management,User_Experience_Management
https://i.ytimg.com/vi/xlqyClwXM2U/mqdefault.jpg,Knoa Software,xlqyClwXM2U,Tech Data SAP User Experience Management Webinar Highlights,User_Experience_Management
https://i.ytimg.com/vi/OGjjwIY0S3s/mqdefault.jpg,aternityinc,OGjjwIY0S3s,Sharp HealthCare Talks Value of End User Experience Management,User_Experience_Management
https://i.ytimg.com/vi/cov8IQoMFTk/mqdefault.jpg,SAPEnterpriseMobile,cov8IQoMFTk,Mobile Place | Mobile App Management with a Superior User Experience for All,User_Experience_Management
https://i.ytimg.com/vi/7QTogXnzZ_4/mqdefault.jpg,Ultimate Software,7QTogXnzZ_4,Ultimate Software on Great User Experience,User_Experience_Management
https://i.ytimg.com/vi/LGeDZmrWwsw/mqdefault.jpg,AgileAcademyAus,LGeDZmrWwsw,Agile In Practice: StoryCards/User Stories,Create_User_Stories
https://i.ytimg.com/vi/iCjLuRmjCmA/mqdefault.jpg,Arijea,iCjLuRmjCmA,Easy Agile User Story Maps for JIRA,Create_User_Stories
https://i.ytimg.com/vi/t1Xq9ne5F58/mqdefault.jpg,Blueprint Software Systems,t1Xq9ne5F58,How to Create Effective User Stories - Tuesday Tips,Create_User_Stories
https://i.ytimg.com/vi/VeO_wHBtSV0/mqdefault.jpg,Richard Griffiths,VeO_wHBtSV0,Team Services Online Create User Story,Create_User_Stories
https://i.ytimg.com/vi/XQCksYWkuVg/mqdefault.jpg,ScrumStudy,XQCksYWkuVg,"Scrum Developer C09M03 Approve, Estimate, and Commit User Stories and Create Tasks Processes",Create_User_Stories
https://i.ytimg.com/vi/cNoBj0bfoTY/mqdefault.jpg,D'Mita Levy,cNoBj0bfoTY,User Story#234 - Create Virtual Machine Templates,Create_User_Stories
https://i.ytimg.com/vi/83nu4yXFcYU/mqdefault.jpg,Wix.com,83nu4yXFcYU,Wix Presents: User Stories,Create_User_Stories
https://i.ytimg.com/vi/q24nKDQi2Wk/mqdefault.jpg,D'Mita Levy,q24nKDQi2Wk,User Story #417 - Create Universally Unique Identifier's for the host,Create_User_Stories
https://i.ytimg.com/vi/gKlSwMaDKOU/mqdefault.jpg,brokenbuildnet,gKlSwMaDKOU,brokenbuild.net: create backlog using greenhopper,Create_User_Stories
https://i.ytimg.com/vi/BBmA5Qp6Ghk/mqdefault.jpg,Guru99,BBmA5Qp6Ghk,How to write a Test Case,Create_User_Stories
https://i.ytimg.com/vi/rMbLKxXzUuM/mqdefault.jpg,Scribble,rMbLKxXzUuM,How To Create A Horror Story,Create_User_Stories
https://i.ytimg.com/vi/R32rylJciT4/mqdefault.jpg,ESEE Scrum Poker,R32rylJciT4,Create User Stories Before The Game | ESEE Scrum Poker,Create_User_Stories
https://i.ytimg.com/vi/dqkVtZqZLlM/mqdefault.jpg,90 Seconds Media,dqkVtZqZLlM,Piktochart | User Story | Booking.com | Thomas Trip,Create_User_Stories
https://i.ytimg.com/vi/A-Nj1f_MoCc/mqdefault.jpg,VisualParadigm,A-Nj1f_MoCc,Using File Reference in User Story,Create_User_Stories
https://i.ytimg.com/vi/nuEOJDuF4IE/mqdefault.jpg,Michael Hamilton,nuEOJDuF4IE,Building a software startup? Remember to create users stories as part of the product development!,Create_User_Stories
https://i.ytimg.com/vi/lXT26ZGNPPs/mqdefault.jpg,wilymanager,lXT26ZGNPPs,7 Steps to Writing a Business Case - A 3-Minute Crash Course,business_case
https://i.ytimg.com/vi/AHktXD4Ujrg/mqdefault.jpg,eHow,AHktXD4Ujrg,Marketing & Public Relations : How to Write an Effective Business Case Study,business_case
https://i.ytimg.com/vi/bDAsAbMMep0/mqdefault.jpg,procurementacademy,bDAsAbMMep0,Business Case - Definitions,business_case
https://i.ytimg.com/vi/XgTBUgLbMnM/mqdefault.jpg,Howcast,XgTBUgLbMnM,How to Write a Great Business Case Study,business_case
https://i.ytimg.com/vi/ZsH4siQGp9I/mqdefault.jpg,IESE Business School,ZsH4siQGp9I,How Do You Prepare a Business Case?,business_case
https://i.ytimg.com/vi/dNqUEqOGB-I/mqdefault.jpg,Demand Metric,dNqUEqOGB-I,Business Case Template,business_case
https://i.ytimg.com/vi/NJwE0UZoGxs/mqdefault.jpg,ProGalore Australia Consulting Services,NJwE0UZoGxs,"Project Management, Business Case Writing",business_case
https://i.ytimg.com/vi/Tv7vOMhb2CU/mqdefault.jpg,Videojug,Tv7vOMhb2CU,How To Create A Professional Business Case,business_case
https://i.ytimg.com/vi/LyVyHPWLH80/mqdefault.jpg,UoGLibrary,LyVyHPWLH80,Four Awesome Things About Business Case Studies,business_case
https://i.ytimg.com/vi/ckazloRBO0Q/mqdefault.jpg,EssentiallyFinancial,ckazloRBO0Q,How to write a business case,business_case
https://i.ytimg.com/vi/UY-R240kWeo/mqdefault.jpg,SAP,UY-R240kWeo,Building a business case for the SAP HANA platform,business_case
https://i.ytimg.com/vi/J83iFmd2Vv4/mqdefault.jpg,Solution Matrix,J83iFmd2Vv4,Business Case erstellen - wie Sie zur perfekten Entscheidung finden,business_case
https://i.ytimg.com/vi/Fy7WYf7VkqU/mqdefault.jpg,procurementacademy,Fy7WYf7VkqU,Business Case - Estimating costs,business_case
https://i.ytimg.com/vi/C-42Mh28HUk/mqdefault.jpg,ZMHealthcare,C-42Mh28HUk,How to make a smart Business Case in PowerPoint - Infant Formula,business_case
https://i.ytimg.com/vi/mchZeAK3Bu8/mqdefault.jpg,SAP BusinessObjects Analytics,mchZeAK3Bu8,Building a Business Case for a Business Intelligence Strategy: BI and Your Success,business_case
https://i.ytimg.com/vi/d-ZOOhsfZ-I/mqdefault.jpg,Austin Atkins,d-ZOOhsfZ-I,Product Life Cycle Examples Video,Product_Lifecycle
https://i.ytimg.com/vi/H1ipwUkxu4I/mqdefault.jpg,Knowledge flow,H1ipwUkxu4I,Marketing: Product Life Cycle,Product_Lifecycle
https://i.ytimg.com/vi/sTBNSFdVa_c/mqdefault.jpg,SAP,sTBNSFdVa_c,SAP Product Lifecycle Costing,Product_Lifecycle
https://i.ytimg.com/vi/x5EbqNcGFfM/mqdefault.jpg,SAP Technology,x5EbqNcGFfM,SAP Connected Product Lifecycle,Product_Lifecycle
https://i.ytimg.com/vi/XC-xMM2jLro/mqdefault.jpg,SAP,XC-xMM2jLro,SAP Product Lifecycle Management - Sustainable Innovation,Product_Lifecycle
https://i.ytimg.com/vi/GzbEHCZwgPE/mqdefault.jpg,MrWaiteDT,GzbEHCZwgPE,Product Lifecycle - The rebranding of Lucozade,Product_Lifecycle
https://i.ytimg.com/vi/7_o97k8uP14/mqdefault.jpg,LifeCycleSolutions,7_o97k8uP14,How do you go about implementing a Product Lifecycle Management (PLM) System?,Product_Lifecycle
https://i.ytimg.com/vi/NQNWEAQutU0/mqdefault.jpg,SAP Extended Supply Chain,NQNWEAQutU0,Product Development with SAP Product Lifecycle Management.mp4,Product_Lifecycle
https://i.ytimg.com/vi/LK_dv1EoD_8/mqdefault.jpg,Introducción al Marketing,LK_dv1EoD_8,The Maturity stage of the Product Life Cycle - The case of McDonalds,Product_Lifecycle
https://i.ytimg.com/vi/s2AlPwiikkg/mqdefault.jpg,ARM,s2AlPwiikkg,PLM with Software Packs,Product_Lifecycle
https://i.ytimg.com/vi/jGScoPLlRbA/mqdefault.jpg,Wolters World,jGScoPLlRbA,The Product Life Cycle Explained,Product_Lifecycle
https://i.ytimg.com/vi/LW8TMDwhc7w/mqdefault.jpg,TechniaTranscat,LW8TMDwhc7w,What is PLM?,Product_Lifecycle
https://i.ytimg.com/vi/rkNxYvyQ7VE/mqdefault.jpg,Siemens PLM,rkNxYvyQ7VE,Siemens PLM Software High Definition Product Lifecycle Managment (HD-PLM) Vision Video,Product_Lifecycle
https://i.ytimg.com/vi/t4Rf8pCN04c/mqdefault.jpg,beCPG,t4Rf8pCN04c,What is PLM software by beCPG,Product_Lifecycle
https://i.ytimg.com/vi/ON8kozB5yhI/mqdefault.jpg,docstocTV,ON8kozB5yhI,What Is Product Life Cycle in Fashion?,Product_Lifecycle
https://i.ytimg.com/vi/2C-2v99paQM/mqdefault.jpg,InfoteamConsulting,2C-2v99paQM,10. Understanding Customer Needs,understand_customer_needs
https://i.ytimg.com/vi/8LmaQaBMqd8/mqdefault.jpg,Nicki Weiss,8LmaQaBMqd8,Sales Tip 5- Understanding Customer Needs,understand_customer_needs
https://i.ytimg.com/vi/yli7O46yuGM/mqdefault.jpg,B2Bwhiteboard,yli7O46yuGM,"What are Customer needs, wants and demands?",understand_customer_needs
https://i.ytimg.com/vi/wT_uAHId8Bc/mqdefault.jpg,MrJ Bilton,wT_uAHId8Bc,Understanding Customer Needs,understand_customer_needs
https://i.ytimg.com/vi/dEcc953w7Ko/mqdefault.jpg,Bedrock Consultants,dEcc953w7Ko,Life of the Customer - The Benefits of Getting to Know Your Customer,understand_customer_needs
https://i.ytimg.com/vi/m6IzZLRzQtQ/mqdefault.jpg,FOUNDER.org,m6IzZLRzQtQ,3 Tips to Understanding Customer Needs,understand_customer_needs
https://i.ytimg.com/vi/kg7triJI6sM/mqdefault.jpg,TrainingWorldUK,kg7triJI6sM,Satisfying Customer Needs - Clip from the DVD,understand_customer_needs
https://i.ytimg.com/vi/vega2R5Cw_I/mqdefault.jpg,Raj Ramesh,vega2R5Cw_I,How well do you understand your customers?,understand_customer_needs
https://i.ytimg.com/vi/SHgb4BNdxbc/mqdefault.jpg,TemkinGroup,SHgb4BNdxbc,The Six Laws of Customer Experience (Temkin Group),understand_customer_needs
https://i.ytimg.com/vi/0dC5ssh34e0/mqdefault.jpg,Menna Nabil,0dC5ssh34e0,How to Know What a Customer Needs & Wants ?,understand_customer_needs
https://i.ytimg.com/vi/CylW-Ys5Us0/mqdefault.jpg,Skillhance,CylW-Ys5Us0,Understanding Customer Needs,understand_customer_needs
https://i.ytimg.com/vi/77tYsoFEl2k/mqdefault.jpg,Benjamin A. Cornett,77tYsoFEl2k,10. Customer Needs Analysis,understand_customer_needs
https://i.ytimg.com/vi/K4gZahGbvQI/mqdefault.jpg,SuperCandidate,K4gZahGbvQI,Understanding Customer Needs,understand_customer_needs
https://i.ytimg.com/vi/J8mQ4o6Q9u8/mqdefault.jpg,OracleANZ,J8mQ4o6Q9u8,The importance of understanding your customers' needs,understand_customer_needs
https://i.ytimg.com/vi/43Mr7fG0CMk/mqdefault.jpg,MyNISCTV,43Mr7fG0CMk,How Marketing Helps Understanding Customers Needs,understand_customer_needs
https://i.ytimg.com/vi/d-ZOOhsfZ-I/mqdefault.jpg,Austin Atkins,d-ZOOhsfZ-I,Product Life Cycle Examples Video,product_lifecycle
https://i.ytimg.com/vi/H1ipwUkxu4I/mqdefault.jpg,Knowledge flow,H1ipwUkxu4I,Marketing: Product Life Cycle,product_lifecycle
https://i.ytimg.com/vi/sTBNSFdVa_c/mqdefault.jpg,SAP,sTBNSFdVa_c,SAP Product Lifecycle Costing,product_lifecycle
https://i.ytimg.com/vi/x5EbqNcGFfM/mqdefault.jpg,SAP Technology,x5EbqNcGFfM,SAP Connected Product Lifecycle,product_lifecycle
https://i.ytimg.com/vi/XC-xMM2jLro/mqdefault.jpg,SAP,XC-xMM2jLro,SAP Product Lifecycle Management - Sustainable Innovation,product_lifecycle
https://i.ytimg.com/vi/GzbEHCZwgPE/mqdefault.jpg,MrWaiteDT,GzbEHCZwgPE,Product Lifecycle - The rebranding of Lucozade,product_lifecycle
https://i.ytimg.com/vi/7_o97k8uP14/mqdefault.jpg,LifeCycleSolutions,7_o97k8uP14,How do you go about implementing a Product Lifecycle Management (PLM) System?,product_lifecycle
https://i.ytimg.com/vi/NQNWEAQutU0/mqdefault.jpg,SAP Extended Supply Chain,NQNWEAQutU0,Product Development with SAP Product Lifecycle Management.mp4,product_lifecycle
https://i.ytimg.com/vi/LK_dv1EoD_8/mqdefault.jpg,Introducción al Marketing,LK_dv1EoD_8,The Maturity stage of the Product Life Cycle - The case of McDonalds,product_lifecycle
https://i.ytimg.com/vi/s2AlPwiikkg/mqdefault.jpg,ARM,s2AlPwiikkg,PLM with Software Packs,product_lifecycle
https://i.ytimg.com/vi/jGScoPLlRbA/mqdefault.jpg,Wolters World,jGScoPLlRbA,The Product Life Cycle Explained,product_lifecycle
https://i.ytimg.com/vi/LW8TMDwhc7w/mqdefault.jpg,TechniaTranscat,LW8TMDwhc7w,What is PLM?,product_lifecycle
https://i.ytimg.com/vi/rkNxYvyQ7VE/mqdefault.jpg,Siemens PLM,rkNxYvyQ7VE,Siemens PLM Software High Definition Product Lifecycle Managment (HD-PLM) Vision Video,product_lifecycle
https://i.ytimg.com/vi/t4Rf8pCN04c/mqdefault.jpg,beCPG,t4Rf8pCN04c,What is PLM software by beCPG,product_lifecycle
https://i.ytimg.com/vi/ON8kozB5yhI/mqdefault.jpg,docstocTV,ON8kozB5yhI,What Is Product Life Cycle in Fashion?,product_lifecycle
https://i.ytimg.com/vi/G2kpQGNxkRc/mqdefault.jpg,Udacity,G2kpQGNxkRc,Competitive Analysis Framework | Understand the User | App Marketing | Udacity,competitive_analysis
https://i.ytimg.com/vi/1BM4BNXNqFs/mqdefault.jpg,Dr. Lau Cher Han,1BM4BNXNqFs,How To Analyze Your Competitors - Competitor Analysis Tool,competitive_analysis
https://i.ytimg.com/vi/UN-ZgSQ4dzI/mqdefault.jpg,Great Business Videos for Great Entrepreneurs - SelfLearnEN,UN-ZgSQ4dzI,How to Write a Marketing Plan A Step by Step Guide - Competitive Analysis,competitive_analysis
https://i.ytimg.com/vi/2wTqfrXrTD0/mqdefault.jpg,WSIWorld,2wTqfrXrTD0,Competitor Analysis: Your Roadmap to Online Success,competitive_analysis
https://i.ytimg.com/vi/eLOUoO4URgA/mqdefault.jpg,42DM formerly WebPromo,eLOUoO4URgA,How to use SEMRush for your competitors analysis,competitive_analysis
https://i.ytimg.com/vi/9TyXBNB2c1I/mqdefault.jpg,InterMarketingSmarts,9TyXBNB2c1I,How To Do Competitive Analysis Using Google Alerts,competitive_analysis
https://i.ytimg.com/vi/sWB3hTKMaqA/mqdefault.jpg,Udacity,sWB3hTKMaqA,Competitive Analysis | Understand the User | App Marketing | Udacity,competitive_analysis
https://i.ytimg.com/vi/ipa-OpGYhtA/mqdefault.jpg,InvespTV,ipa-OpGYhtA,#invespCRO episode 4: Conducting Competitive Analysis,competitive_analysis
https://i.ytimg.com/vi/H-74k5vclCU/mqdefault.jpg,edX,H-74k5vclCU,Marketing Analytics: Competitive Analysis and Market Segmentation | UC BerkeleyX on edX,competitive_analysis
https://i.ytimg.com/vi/sHi23eN34Bw/mqdefault.jpg,PPC Masterminds | PPC Management Company,sHi23eN34Bw,How to do a competitive analysis: Tools to beat your competitors,competitive_analysis
https://i.ytimg.com/vi/Wog4RR4BiFY/mqdefault.jpg,Affiliate Marketing Basics,Wog4RR4BiFY,Keyword Competition Analysis,competitive_analysis
https://i.ytimg.com/vi/zrZzZAqd9cg/mqdefault.jpg,Rivalfox,zrZzZAqd9cg,Competitive Analysis - Social Media Strategy,competitive_analysis
https://i.ytimg.com/vi/oO3EWj_2Les/mqdefault.jpg,agorapulse,oO3EWj_2Les,Facebook Competitive Analysis,competitive_analysis
https://i.ytimg.com/vi/LHiV5oqAQAA/mqdefault.jpg,Sociota,LHiV5oqAQAA,Social Media Competitor Analysis using Sociota,competitive_analysis
https://i.ytimg.com/vi/vLeYwRAAzuU/mqdefault.jpg,Demand Metric,vLeYwRAAzuU,Competitive Analysis Tool,competitive_analysis
https://i.ytimg.com/vi/H1Ie8Xr9-tI/mqdefault.jpg,VisualParadigm,H1Ie8Xr9-tI,From Business Process to Use Cases,use_cases
https://i.ytimg.com/vi/SmcBTsPsbIY/mqdefault.jpg,rmb1905,SmcBTsPsbIY,3.03_A Use Case Diagram for an ATM,use_cases
https://i.ytimg.com/vi/aaAjndV5kBg/mqdefault.jpg,VisualParadigm,aaAjndV5kBg,How to Elaborate Use Case with UML Sequence Diagram,use_cases
https://i.ytimg.com/vi/iwDeLZKkwRQ/mqdefault.jpg,franky776,iwDeLZKkwRQ,C++ Tutorial - Switch case statement,use_cases
https://i.ytimg.com/vi/poVISe5NF3M/mqdefault.jpg,Windows and Linux Tutorials from Howtech,poVISe5NF3M,How to use the switch Statement in C#,use_cases
https://i.ytimg.com/vi/ijtvAvapsP0/mqdefault.jpg,Guru99,ijtvAvapsP0,Use Case Testing: Software Testing Tutorial 18,use_cases
https://i.ytimg.com/vi/0BBtMiBwEF8/mqdefault.jpg,VisualParadigm,0BBtMiBwEF8,How to List Out All Use Cases in Your Project,use_cases
https://i.ytimg.com/vi/TqB_TqNmzmM/mqdefault.jpg,Udacity,TqB_TqNmzmM,But HOW Do We Make Personas/Use Cases? - UX Design for Mobile Developers,use_cases
https://i.ytimg.com/vi/RHyNR5Cm8Tc/mqdefault.jpg,ObjectRocket,RHyNR5Cm8Tc,What's a good use case for Redis?,use_cases
https://i.ytimg.com/vi/_xtZIDI8Ajg/mqdefault.jpg,Erum Kibriya,_xtZIDI8Ajg,UML Use Case Diagram – MS Visio 2013,use_cases
https://i.ytimg.com/vi/cgS3u0nupfs/mqdefault.jpg,LabVIEW,cgS3u0nupfs,Using LabVIEW Case Structures,use_cases
https://i.ytimg.com/vi/_aTFQ69h1FQ/mqdefault.jpg,Udacity,_aTFQ69h1FQ,Role of Use Cases - Georgia Tech - Software Development Process,use_cases
https://i.ytimg.com/vi/LRRWtkCjEDs/mqdefault.jpg,Udacity,LRRWtkCjEDs,Use Case Diagram: Actors - Georgia Tech - Software Development Process,use_cases
https://i.ytimg.com/vi/3mDNFzCSCgs/mqdefault.jpg,philippeback,3mDNFzCSCgs,Use Cases Basics,use_cases
https://i.ytimg.com/vi/Tm8InwqiK5I/mqdefault.jpg,Corporate Education Group,Tm8InwqiK5I,Use Cases and User Stories,use_cases
https://i.ytimg.com/vi/lXT26ZGNPPs/mqdefault.jpg,wilymanager,lXT26ZGNPPs,7 Steps to Writing a Business Case - A 3-Minute Crash Course,business_cases
https://i.ytimg.com/vi/ZsH4siQGp9I/mqdefault.jpg,IESE Business School,ZsH4siQGp9I,How Do You Prepare a Business Case?,business_cases
https://i.ytimg.com/vi/XgTBUgLbMnM/mqdefault.jpg,Howcast,XgTBUgLbMnM,How to Write a Great Business Case Study,business_cases
https://i.ytimg.com/vi/bDAsAbMMep0/mqdefault.jpg,procurementacademy,bDAsAbMMep0,Business Case - Definitions,business_cases
https://i.ytimg.com/vi/LyVyHPWLH80/mqdefault.jpg,UoGLibrary,LyVyHPWLH80,Four Awesome Things About Business Case Studies,business_cases
https://i.ytimg.com/vi/AHktXD4Ujrg/mqdefault.jpg,eHow,AHktXD4Ujrg,Marketing & Public Relations : How to Write an Effective Business Case Study,business_cases
https://i.ytimg.com/vi/dNqUEqOGB-I/mqdefault.jpg,Demand Metric,dNqUEqOGB-I,Business Case Template,business_cases
https://i.ytimg.com/vi/sIRUQnwPBms/mqdefault.jpg,State Farm Insurance,sIRUQnwPBms,Brothers Start Thriving Phone Case Business During College,business_cases
https://i.ytimg.com/vi/H1Ie8Xr9-tI/mqdefault.jpg,VisualParadigm,H1Ie8Xr9-tI,From Business Process to Use Cases,business_cases
https://i.ytimg.com/vi/mchZeAK3Bu8/mqdefault.jpg,SAP BusinessObjects Analytics,mchZeAK3Bu8,Building a Business Case for a Business Intelligence Strategy: BI and Your Success,business_cases
https://i.ytimg.com/vi/Tv7vOMhb2CU/mqdefault.jpg,Videojug,Tv7vOMhb2CU,How To Create A Professional Business Case,business_cases
https://i.ytimg.com/vi/J83iFmd2Vv4/mqdefault.jpg,Solution Matrix,J83iFmd2Vv4,Business Case erstellen - wie Sie zur perfekten Entscheidung finden,business_cases
https://i.ytimg.com/vi/NJwE0UZoGxs/mqdefault.jpg,ProGalore Australia Consulting Services,NJwE0UZoGxs,"Project Management, Business Case Writing",business_cases
