Video_Image,Video_Author,Video_ID,Video_title,Video_Skill
https://i.ytimg.com/vi/S52Weimu8Y4/mqdefault.jpg,DreamWorksTV,S52Weimu8Y4,"HOW TO TRAIN YOUR DRAGON - Interview with Gabe Hordos, Supervising Animator",Supervising
https://i.ytimg.com/vi/OP7FLS3rJUU/mqdefault.jpg,YAINETWORK2,OP7FLS3rJUU,The Challenges of Supervising Staff: A Training DVD for the Front Line Managers in the Field of Developmental Disabilities,Supervising
https://i.ytimg.com/vi/2SVLcCqSoeY/mqdefault.jpg,DreamWorksTV,2SVLcCqSoeY,"HOW TO TRAIN YOUR DRAGON - Interview with Kristof Serrand, Supervising Animator",Supervising
https://i.ytimg.com/vi/O8VhZbiPJ7k/mqdefault.jpg,expertvillage,O8VhZbiPJ7k,How to Care for Pet Mice : Supervising Your Children with Your Pet Mouse,Supervising
https://i.ytimg.com/vi/MGYq08V0Dxg/mqdefault.jpg,Global Courseware,MGYq08V0Dxg,Supervising Others,Supervising
https://i.ytimg.com/vi/EhlU3n9k128/mqdefault.jpg,DreamWorksTV,EhlU3n9k128,"HOW TO TRAIN YOUR DRAGON - Interview with Shaggy Hornsby, Supervising Animator",Supervising
https://i.ytimg.com/vi/LSDdbrlQB_8/mqdefault.jpg,Robert Brandau,LSDdbrlQB_8,Supervising Dogs and Children,Supervising
https://i.ytimg.com/vi/-EtY3b4_iG8/mqdefault.jpg,DragonBassist,-EtY3b4_iG8,HOW TO TRAIN YOUR DRAGON 2 - John Carr (Supervising Editor) Interview,Supervising
https://i.ytimg.com/vi/-8JCSCf_wA4/mqdefault.jpg,Project Management Videos,-8JCSCf_wA4,How to Manage Tasks and Lead People - Leadership Training,Managing_
https://i.ytimg.com/vi/go5XyuI7DkA/mqdefault.jpg,Entrepreneur,go5XyuI7DkA,How to Manage Time With 10 Tips That Work,Managing_
https://i.ytimg.com/vi/hdk7j9KPZX4/mqdefault.jpg,eHowEducation,hdk7j9KPZX4,The Restaurant Business : How to Manage a Restaurant,Managing_
https://i.ytimg.com/vi/d1u7THOudfw/mqdefault.jpg,Toastmasters,d1u7THOudfw,Managing Fear,Managing_
https://i.ytimg.com/vi/vfcBr4Mlzbc/mqdefault.jpg,GoDaddy,vfcBr4Mlzbc,GoDaddy How-to - Managing DNS for Your Domain Names,Managing_
https://i.ytimg.com/vi/flG4gFIiZzU/mqdefault.jpg,Federal Student Aid,flG4gFIiZzU,How to Manage Your Student Loans,Managing_
https://i.ytimg.com/vi/8F6X6GYKssY/mqdefault.jpg,cashflowkungfu,8F6X6GYKssY,How To Manage Your Business Cash Flow Effectively And Efficiently,Managing_
https://i.ytimg.com/vi/Z0Ktwu-SU4A/mqdefault.jpg,BNETvideo,Z0Ktwu-SU4A,Manage the People Managing You | At the Whiteboard,Managing_
https://i.ytimg.com/vi/WMj4AknyX6o/mqdefault.jpg,GCFLearnFree.org,WMj4AknyX6o,Gmail: Managing Email with Gmail,Managing_
https://i.ytimg.com/vi/iR2HCi_1gFc/mqdefault.jpg,ehowfinance,iR2HCi_1gFc,How to Manage a Pub,Managing_
https://i.ytimg.com/vi/cZjG_JKbhjM/mqdefault.jpg,eHow,cZjG_JKbhjM,Stage Lighting & Managing : How to Stage Manage,Managing_
https://i.ytimg.com/vi/YbhP0R0n-Lc/mqdefault.jpg,expertvillage,YbhP0R0n-Lc,How to Budget Personal Finances : The Envelope System for Managing a Budget,Managing_
https://i.ytimg.com/vi/xKY6YrKamqM/mqdefault.jpg,Australian Psychological Society,xKY6YrKamqM,Tips on how to manage everyday stress,Managing_
https://i.ytimg.com/vi/7S_BB7R8NMU/mqdefault.jpg,"CRM Learning, L.P.",7S_BB7R8NMU,"Managing Stress - Fight or Flight clip, How To Manage Stress Training Video",Managing_
https://i.ytimg.com/vi/HGVJMsuUE0s/mqdefault.jpg,IntegrationTraining & Embodied Facilitator Course,HGVJMsuUE0s,Managing Anxiety / How to Cope - Tips & Techniques,Managing_
https://i.ytimg.com/vi/go5XyuI7DkA/mqdefault.jpg,Entrepreneur,go5XyuI7DkA,How to Manage Time With 10 Tips That Work,Manager_Management
https://i.ytimg.com/vi/-8JCSCf_wA4/mqdefault.jpg,Project Management Videos,-8JCSCf_wA4,How to Manage Tasks and Lead People - Leadership Training,Manager_Management
https://i.ytimg.com/vi/S_NdZdOJpkk/mqdefault.jpg,Project Management Videos,S_NdZdOJpkk,The Top 5 People Management Skills,Manager_Management
https://i.ytimg.com/vi/hnpQrMqDoqE/mqdefault.jpg,BBC,hnpQrMqDoqE,Managing Stress - Brainsmart - BBC,Manager_Management
https://i.ytimg.com/vi/f60dheI4ARg/mqdefault.jpg,ragni,f60dheI4ARg,Steve Jobs talks about managing people,Manager_Management
https://i.ytimg.com/vi/Y0avdzxAONU/mqdefault.jpg,ArtistsHouseMusic,Y0avdzxAONU,What Does an Artist Manager Do?,Manager_Management
https://i.ytimg.com/vi/wgowVpdQa_w/mqdefault.jpg,ehowfinance,wgowVpdQa_w,Business Management Skills : How to Become a Manager,Manager_Management
https://i.ytimg.com/vi/Bg-gWBQ66hk/mqdefault.jpg,scott watson,Bg-gWBQ66hk,How To Manage Poor Performance - Management Training Tips,Manager_Management
https://i.ytimg.com/vi/8F6X6GYKssY/mqdefault.jpg,cashflowkungfu,8F6X6GYKssY,How To Manage Your Business Cash Flow Effectively And Efficiently,Manager_Management
https://i.ytimg.com/vi/kMCW69ZgkBI/mqdefault.jpg,Kabbage Incorporated,kMCW69ZgkBI,Cash Flow Management for Small Businesses,Manager_Management
https://i.ytimg.com/vi/_Ip3xkk8eg4/mqdefault.jpg,"Boone Wealth Advisors, LLC",_Ip3xkk8eg4,How to Manage Debt,Manager_Management
https://i.ytimg.com/vi/92u16JFbF0I/mqdefault.jpg,Project Management Videos,92u16JFbF0I,How to Manage Large Projects - Project Management Training,Manager_Management
https://i.ytimg.com/vi/Ofws8Tl0UXg/mqdefault.jpg,Project Management Videos,Ofws8Tl0UXg,How To Manage Small Projects - Project Management Training,Manager_Management
https://i.ytimg.com/vi/VDyTgr5zChA/mqdefault.jpg,Major Decision,VDyTgr5zChA,How to become a Hotel Manager - Chapter 1,Manager_Management
https://i.ytimg.com/vi/XKkXSBZ-Ytk/mqdefault.jpg,Kevolve Product Management,XKkXSBZ-Ytk,3 Minute Product Manager: Strategic Role of Product Management,Manager_Management
https://i.ytimg.com/vi/s5jlNi03m7s/mqdefault.jpg,openboxcommunication,s5jlNi03m7s,Talent Management Explained,Talent_Management
https://i.ytimg.com/vi/ltjDJAF2yrQ/mqdefault.jpg,TMA methode,ltjDJAF2yrQ,Three basic principles of great talent management,Talent_Management
https://i.ytimg.com/vi/_m7tRotajdo/mqdefault.jpg,PeopleStreme,_m7tRotajdo,"Talent Management, Talent Identification, Succession Planning and Employee Retention",Talent_Management
https://i.ytimg.com/vi/c_pJTuidmbY/mqdefault.jpg,Learningyourdevelopment.com,c_pJTuidmbY,Talent Management Strategy,Talent_Management
https://i.ytimg.com/vi/bmO9uZPqwKc/mqdefault.jpg,TipsOnActing,bmO9uZPqwKc,Talent Managers & Talent Agents: The Love/Hate Relationship and What All Actors Must Know,Talent_Management
https://i.ytimg.com/vi/sUUYfd4udYo/mqdefault.jpg,MeettheBossCOM,sUUYfd4udYo,Head of HR at ABB on talent management and good leadership,Talent_Management
https://i.ytimg.com/vi/KDNWF3ELld8/mqdefault.jpg,TipsOnActing,KDNWF3ELld8,Lunch With The A-List (Pt 1) | How Talent Managers Find Actors To Represent | Acting Tips,Talent_Management
https://i.ytimg.com/vi/lh9PhYVM97k/mqdefault.jpg,hrlabdotcom,lh9PhYVM97k,Talent Management Software,Talent_Management
https://i.ytimg.com/vi/YB1P_mvBb4Q/mqdefault.jpg,perview,YB1P_mvBb4Q,perview Talent Management & Performance Management Suite,Talent_Management
https://i.ytimg.com/vi/PnAvPvi3ftQ/mqdefault.jpg,Berlin School,PnAvPvi3ftQ,'Strategic Talent Management',Talent_Management
https://i.ytimg.com/vi/o5SRnWnYt4w/mqdefault.jpg,Workday,o5SRnWnYt4w,Moving Away From a Talent Management Mindset,Talent_Management
https://i.ytimg.com/vi/Bh2tKZ50CKU/mqdefault.jpg,ttaing11,Bh2tKZ50CKU,What is Talent Management?,Talent_Management
https://i.ytimg.com/vi/ORuDZCAS6FA/mqdefault.jpg,SAP SuccessFactors,ORuDZCAS6FA,SAP SuccessFactors Talent Management Suite Overview,Talent_Management
https://i.ytimg.com/vi/IIqma01T40s/mqdefault.jpg,Haufe DE,IIqma01T40s,Haufe Talent Management Gipfel 2016,Talent_Management
https://i.ytimg.com/vi/SJO654xtkpw/mqdefault.jpg,Zee News,SJO654xtkpw,DNA: Dr Subhash Chandra will reveal the importance of 'Talent Management',Talent_Management
https://i.ytimg.com/vi/SjjZCHZ8OQs/mqdefault.jpg,Michel Theriault,SjjZCHZ8OQs,Managing Remote Staff & Getting Them To Work Together,Managing_Remote_Teams
https://i.ytimg.com/vi/wf9TrzRhdtU/mqdefault.jpg,Chris Pirillo,wf9TrzRhdtU,Remote Team Management Tips,Managing_Remote_Teams
https://i.ytimg.com/vi/nc-wsPRtN4k/mqdefault.jpg,TMA World Videos,nc-wsPRtN4k,Managing Virtual Teams: Virtual Empathy,Managing_Remote_Teams
https://i.ytimg.com/vi/OdvYbuBt81k/mqdefault.jpg,Managing Virtual Teams,OdvYbuBt81k,Managing Virtual Teams - Communication,Managing_Remote_Teams
https://i.ytimg.com/vi/gvbA3jPYiGI/mqdefault.jpg,scott watson,gvbA3jPYiGI,How To Manage Remote Teams Training Course,Managing_Remote_Teams
https://i.ytimg.com/vi/Fhaz1cyN7_w/mqdefault.jpg,TG Studios,Fhaz1cyN7_w,Peerdrum - Beautiful - Managing Remote Teams,Managing_Remote_Teams
https://i.ytimg.com/vi/yQmFFXnfdas/mqdefault.jpg,Macalister Bali,yQmFFXnfdas,Notable Ways to Manage a Remote Team,Managing_Remote_Teams
https://i.ytimg.com/vi/k2NVa6-cc4w/mqdefault.jpg,Managing Virtual Teams,k2NVa6-cc4w,Managing Virtual Teams - Trust .,Managing_Remote_Teams
https://i.ytimg.com/vi/pxMWHDjH2SA/mqdefault.jpg,YEC,pxMWHDjH2SA,Working Remotely: How to manage virtual teams with Eric Koester of YEC,Managing_Remote_Teams
https://i.ytimg.com/vi/CZDqKdunxyk/mqdefault.jpg,TMA World Videos,CZDqKdunxyk,Managing Remote Workers: Energizing the team,Managing_Remote_Teams
https://i.ytimg.com/vi/9LG8hA3zb2U/mqdefault.jpg,RequirementONE,9LG8hA3zb2U,RequirementOne - How To Work With Remote Teams,Managing_Remote_Teams
https://i.ytimg.com/vi/B8GOh52QX7U/mqdefault.jpg,TG Studios,B8GOh52QX7U,Peerdrum Teaser - Manage Remote Teams,Managing_Remote_Teams
https://i.ytimg.com/vi/9CxgYGW55fw/mqdefault.jpg,Managing Virtual Teams,9CxgYGW55fw,Managing Virtual Teams - Manage Goals Not Tasks,Managing_Remote_Teams
https://i.ytimg.com/vi/LQCneAaB-z0/mqdefault.jpg,TMA World Videos,LQCneAaB-z0,Making the Best Use of Remote Team Talent,Managing_Remote_Teams
https://i.ytimg.com/vi/fjyVd5R1Vzw/mqdefault.jpg,Andrew Schwartz,fjyVd5R1Vzw,Remote Teams PowerPoint Content,Managing_Remote_Teams
https://i.ytimg.com/vi/Y1YokiumAkQ/mqdefault.jpg,INSEAD,Y1YokiumAkQ,Managing Global Virtual Teams,Managing_Virtual_Teams
https://i.ytimg.com/vi/OdvYbuBt81k/mqdefault.jpg,Managing Virtual Teams,OdvYbuBt81k,Managing Virtual Teams - Communication,Managing_Virtual_Teams
https://i.ytimg.com/vi/k2NVa6-cc4w/mqdefault.jpg,Managing Virtual Teams,k2NVa6-cc4w,Managing Virtual Teams - Trust .,Managing_Virtual_Teams
https://i.ytimg.com/vi/UyUQ3y8oUTE/mqdefault.jpg,Melbourne SEO Services,UyUQ3y8oUTE,Managing Virtual Teams Top Tip,Managing_Virtual_Teams
https://i.ytimg.com/vi/0SzWrazgt7Y/mqdefault.jpg,Kellogg School of Management,0SzWrazgt7Y,Optimizing virtual teams,Managing_Virtual_Teams
https://i.ytimg.com/vi/nc-wsPRtN4k/mqdefault.jpg,TMA World Videos,nc-wsPRtN4k,Managing Virtual Teams: Virtual Empathy,Managing_Virtual_Teams
https://i.ytimg.com/vi/ZEUYFkGEurA/mqdefault.jpg,Patrick Dixon Futurist Keynote Speaker for Industry Conference,ZEUYFkGEurA,How (not) to do video calls: virtual teams management advice - Leadership Keynote Speaker,Managing_Virtual_Teams
https://i.ytimg.com/vi/ONQgN2DKWqY/mqdefault.jpg,Katy Tynan,ONQgN2DKWqY,Managing a Virtual Team,Managing_Virtual_Teams
https://i.ytimg.com/vi/pxMWHDjH2SA/mqdefault.jpg,YEC,pxMWHDjH2SA,Working Remotely: How to manage virtual teams with Eric Koester of YEC,Managing_Virtual_Teams
https://i.ytimg.com/vi/-RWHZSUuLms/mqdefault.jpg,Mannaz,-RWHZSUuLms,Virtual Team Management,Managing_Virtual_Teams
https://i.ytimg.com/vi/9CxgYGW55fw/mqdefault.jpg,Managing Virtual Teams,9CxgYGW55fw,Managing Virtual Teams - Manage Goals Not Tasks,Managing_Virtual_Teams
https://i.ytimg.com/vi/15B-EA5Ssjk/mqdefault.jpg,Managing Virtual Teams,15B-EA5Ssjk,Managing Virtual Teams - Motivate Rather than Move,Managing_Virtual_Teams
https://i.ytimg.com/vi/LKeWb3gXEfA/mqdefault.jpg,Managing Virtual Teams,LKeWb3gXEfA,Managing Virtual Teams - Team Community,Managing_Virtual_Teams
https://i.ytimg.com/vi/TKevcW8Kl5Y/mqdefault.jpg,Managing Virtual Teams,TKevcW8Kl5Y,Managing Virtual Teams - Micro-Monitor for Accountability,Managing_Virtual_Teams
https://i.ytimg.com/vi/jtO3txhAqSM/mqdefault.jpg,The Couch Manager,jtO3txhAqSM,Managing and Influencing Virtual Teams - Course Overview,Managing_Virtual_Teams
https://i.ytimg.com/vi/qOmlpoo1iyg/mqdefault.jpg,Paladin Risk,qOmlpoo1iyg,The difference between Risk Management and Crisis Management,Crisis_Management
https://i.ytimg.com/vi/YK7hGtd0wkY/mqdefault.jpg,CultureCounterFilm,YK7hGtd0wkY,Crisis Management,Crisis_Management
https://i.ytimg.com/vi/LTRW5tlCXSg/mqdefault.jpg,JoTo PR,LTRW5tlCXSg,Crisis Management PR,Crisis_Management
https://i.ytimg.com/vi/Rmt6HtSSNBs/mqdefault.jpg,THE LAB h,Rmt6HtSSNBs,4P² for Crisis Management by THE LAB h,Crisis_Management
https://i.ytimg.com/vi/qr_1O75185o/mqdefault.jpg,Deloitte US,qr_1O75185o,Crisis management wargaming,Crisis_Management
https://i.ytimg.com/vi/0GGdFhHG8xQ/mqdefault.jpg,Tony Ridley,0GGdFhHG8xQ,Crisis Management: Crisis Management Plans by Tony Ridley,Crisis_Management
https://i.ytimg.com/vi/jEzHJZYDxcA/mqdefault.jpg,Philip West,jEzHJZYDxcA,Crisis Commander: The Ultimate Tool for Crisis Management,Crisis_Management
https://i.ytimg.com/vi/Zhgrqkvw5Uc/mqdefault.jpg,Desirae Franco,Zhgrqkvw5Uc,Crisis Management,Crisis_Management
https://i.ytimg.com/vi/Hh9Tm4L6zW4/mqdefault.jpg,Rijkswaterstaat,Hh9Tm4L6zW4,Animation Crisismanagement,Crisis_Management
https://i.ytimg.com/vi/CcSyq4e6eIA/mqdefault.jpg,Cwerty411,CcSyq4e6eIA,Crisis Management | Got Bad News? Spit it Out!,Crisis_Management
https://i.ytimg.com/vi/G_XwMI5d1O4/mqdefault.jpg,NATO,G_XwMI5d1O4,"""Ukraine 2015"" - The NATO crisis management response",Crisis_Management
https://i.ytimg.com/vi/Ub89mJXX0zM/mqdefault.jpg,"Detroit Central City Community Mental Health, Inc.",Ub89mJXX0zM,Crisis Management,Crisis_Management
https://i.ytimg.com/vi/Ybtq_Z10lQY/mqdefault.jpg,Steven Hiller,Ybtq_Z10lQY,Public Relations Functions: Crisis Management,Crisis_Management
https://i.ytimg.com/vi/kIwjH0df1ig/mqdefault.jpg,Howcast,kIwjH0df1ig,Damage Control & Crisis Management | Public Relations,Crisis_Management
https://i.ytimg.com/vi/Wfi1lEC0TRg/mqdefault.jpg,Tony Ridley,Wfi1lEC0TRg,Crisis Management and Leadership Training:1. Intro-Basics by Tony Ridley,Crisis_Management
https://i.ytimg.com/vi/qgbc-uCSRaw/mqdefault.jpg,karen friedman,qgbc-uCSRaw,How to Be a Great Facilitator,Facilitation
https://i.ytimg.com/vi/UDLGjKBHSXg/mqdefault.jpg,IIFACWEB,UDLGjKBHSXg,What Do Facilitators Do,Facilitation
https://i.ytimg.com/vi/C0s85huv1AE/mqdefault.jpg,Active Presence,C0s85huv1AE,Facilitation Skills: Best & Worst Facilitator Practices,Facilitation
https://i.ytimg.com/vi/9_BSu7W26og/mqdefault.jpg,essencecommunication,9_BSu7W26og,Essence- 7 secrets of facilitation,Facilitation
https://i.ytimg.com/vi/KhjdCRX3gR0/mqdefault.jpg,Center for the Army Profession and Ethic (CAPE),KhjdCRX3gR0,Introduction to Facilitation Methods - Part 1,Facilitation
https://i.ytimg.com/vi/SkyE-Wf7vx8/mqdefault.jpg,Simon Fraser University Continuing Studies,SkyE-Wf7vx8,Effective Group Facilitation with Julian Griggs,Facilitation
https://i.ytimg.com/vi/v8VtknxQ2TE/mqdefault.jpg,Jerry Evansk,v8VtknxQ2TE,10 bad facilitation techniques,Facilitation
https://i.ytimg.com/vi/tcNy2ABFVE8/mqdefault.jpg,q q,tcNy2ABFVE8,lesson 44 Language Learning Facilitation 1,Facilitation
https://i.ytimg.com/vi/eEYEyzW7u6g/mqdefault.jpg,Directo Voyage,eEYEyzW7u6g,"Directo Voyage - Workshop on ""FACILITATION SKILLS""",Facilitation
https://i.ytimg.com/vi/xQW1fEwYZVA/mqdefault.jpg,Dana Brownlee,xQW1fEwYZVA,Meeting from Hell!  Running A Meeting or Drowning in Chaos?  (Facilitation Training - Dana Brownlee),Facilitation
https://i.ytimg.com/vi/9BesLaiRd1Q/mqdefault.jpg,Train in a Day,9BesLaiRd1Q,Facilitation Skills Training,Facilitation
https://i.ytimg.com/vi/H0QZbwqp4lg/mqdefault.jpg,BiggerPictureVideo,H0QZbwqp4lg,Learning Graphic Facilitation – 8th Element by Bigger Picture,Facilitation
https://i.ytimg.com/vi/IflMSq2-gjc/mqdefault.jpg,BusinessGovAu,IflMSq2-gjc,Supply Chain Facilitation Workshop - How to write tenders that standout and win,Facilitation
https://i.ytimg.com/vi/ZfPoMWyUBPA/mqdefault.jpg,Management Training Institute,ZfPoMWyUBPA,Facilitator Facilitation Skills & Learning Online Training Techniques,Facilitation
https://i.ytimg.com/vi/ZuUIOC60zSo/mqdefault.jpg,ICA Associates Inc.,ZuUIOC60zSo,Group Facilitation Methods course ICA Associates,Facilitation
https://i.ytimg.com/vi/ohESy9o2YPk/mqdefault.jpg,Grant Cardone,ohESy9o2YPk,How to Sell Yourself in a Job Interview,Selling
https://i.ytimg.com/vi/Z2F-wc1OV7s/mqdefault.jpg,Gwenn Seemel,Z2F-wc1OV7s,How to start selling art,Selling
https://i.ytimg.com/vi/SxCXDsNF5OU/mqdefault.jpg,eHow,SxCXDsNF5OU,"How to Become Better at Selling Clothing in a Store : Marketing, Branding, & Work Life",Selling
https://i.ytimg.com/vi/cXtIZuWWGzQ/mqdefault.jpg,expertvillage,cXtIZuWWGzQ,Buying & Selling Jewelry : How to Sell Jewelry,Selling
https://i.ytimg.com/vi/k0iN5gx9gP4/mqdefault.jpg,expertvillage,k0iN5gx9gP4,Selling Jewelry : How to Sell Jewelry From Home,Selling
https://i.ytimg.com/vi/PklYH-697-o/mqdefault.jpg,Rightmove,PklYH-697-o,How to sell your home fast: Top tips for selling success,Selling
https://i.ytimg.com/vi/9hK89Qc2cko/mqdefault.jpg,ehowauto,9hK89Qc2cko,Buying & Selling Cars : How to Sell a Car Fast,Selling
https://i.ytimg.com/vi/MbgctI_9bTE/mqdefault.jpg,Howcast,MbgctI_9bTE,How to Sell Your Music on iTunes,Selling
https://i.ytimg.com/vi/JS_Rrg2fgsM/mqdefault.jpg,expertvillage,JS_Rrg2fgsM,Buying & Selling Jewelry : How to Sell Handmade Jewelry at Home Parties,Selling
https://i.ytimg.com/vi/EXyyFFh5Qcg/mqdefault.jpg,CCSalesPro,EXyyFFh5Qcg,The Secret to Selling Merchant Services - Learn How to Sell - Credit Card Processing,Selling
https://i.ytimg.com/vi/PTObzkc_GCI/mqdefault.jpg,Howcast,PTObzkc_GCI,How to Sell at Farmers Markets,Selling
https://i.ytimg.com/vi/abDPHDqUIYA/mqdefault.jpg,ehowfinance,abDPHDqUIYA,How to Sell Health & Life Insurance From Home : Selling Insurance,Selling
https://i.ytimg.com/vi/TNuHAtY_FJo/mqdefault.jpg,ehowfinance,TNuHAtY_FJo,Buying & Selling Homes : How to Sell Your House Fast,Selling
https://i.ytimg.com/vi/cq2QT1EaQwI/mqdefault.jpg,Raiken Profit,cq2QT1EaQwI,Selling Books on Amazon - How I Turned $7 into $400 With Used Books,Selling
https://i.ytimg.com/vi/sKRQ044fIfc/mqdefault.jpg,ehowfinance,sKRQ044fIfc,How to Profit From Selling Shea Butter : Business & Marketing,Selling
https://i.ytimg.com/vi/Tjnq5StX68g/mqdefault.jpg,Dinesh De Alwis,Tjnq5StX68g,World Best Motivational Videos for Students,Inspiring
https://i.ytimg.com/vi/2n7wd8hHWmI/mqdefault.jpg,Britt Michaelian,2n7wd8hHWmI,How to Be a Leader 20 Inspiring Quotes on Leadership,Inspiring
https://i.ytimg.com/vi/PGatzxZx7u8/mqdefault.jpg,greatprox,PGatzxZx7u8,Powerful Motivation and Inspiration for Life,Inspiring
https://i.ytimg.com/vi/MWoS9oFJIzY/mqdefault.jpg,cyberseniorscorner,MWoS9oFJIzY,Inspiring - Older Man Talks About How to Create a Life of Purpose For Seniors,Inspiring
https://i.ytimg.com/vi/7BGequY7UbM/mqdefault.jpg,BINDLIKELY,7BGequY7UbM,How To Make Duterte's Inaugural Speech Inspiring,Inspiring
https://i.ytimg.com/vi/y6JiYiHGxTM/mqdefault.jpg,Saida Desilets,y6JiYiHGxTM,How To Be Sensually Inspiring,Inspiring
https://i.ytimg.com/vi/bd3uKMmdvS0/mqdefault.jpg,videoinspiration2,bd3uKMmdvS0,Sometimes Children Inspire Teachers,Inspiring
https://i.ytimg.com/vi/zLYECIjmnQs/mqdefault.jpg,MotivatingSuccess,zLYECIjmnQs,Famous Failures,Inspiring
https://i.ytimg.com/vi/3yFiqdCjNMk/mqdefault.jpg,theJourneyofPurpose TJOP,3yFiqdCjNMk,Follow Your Heart - Inspiring Video,Inspiring
https://i.ytimg.com/vi/o5ZEgPIoZjw/mqdefault.jpg,Video Inspiration,o5ZEgPIoZjw,Steve Jobs Inspiring Speech - Most Important Life Lesson for All,Inspiring
https://i.ytimg.com/vi/2PUVyixT6F0/mqdefault.jpg,Teamwork and Leadership,2PUVyixT6F0,Leaders Care - Leadership Story and Inspiring Leadership Video,Inspiring
https://i.ytimg.com/vi/SyiD96P-JXo/mqdefault.jpg,kikki.K,SyiD96P-JXo,How to Create an Inspiring Vision Board,Inspiring
https://i.ytimg.com/vi/zjW_SQIbqF0/mqdefault.jpg,Inspire With Video,zjW_SQIbqF0,"BE A HERO - Make Inspiring Videos, Motivational Videos and Inspirational Videos and Be A Hero : )",Inspiring
https://i.ytimg.com/vi/xjejTQdK5OI/mqdefault.jpg,Gordon Attard,xjejTQdK5OI,Inspiring Heather Dorniden Takes a Fall But Still Wins the Race,Inspiring
https://i.ytimg.com/vi/0WmryhioApY/mqdefault.jpg,JohnNada80,0WmryhioApY,Dying College Professor Gives Inspiring Speech,Inspiring
https://i.ytimg.com/vi/fT2wVTv7k6g/mqdefault.jpg,Tony Bynes,fT2wVTv7k6g,3 simple rules to persuade people to help you,Persuasion
https://i.ytimg.com/vi/FHOAyoY9Luk/mqdefault.jpg,Online Communication Skills Training Videos with Dan O'Connor,FHOAyoY9Luk,Effective Communication and Sales Skills: How to Become More Persuasive IN 90 SECONDS FLAT!,Persuasion
https://i.ytimg.com/vi/KlduzG27hjI/mqdefault.jpg,Business Insider,KlduzG27hjI,The 4 Most Persuasive Words In The English Language,Persuasion
https://i.ytimg.com/vi/AvvxCrHXUpQ/mqdefault.jpg,In59seconds,AvvxCrHXUpQ,Persuasion mind trick: How to impress in meetings,Persuasion
https://i.ytimg.com/vi/azttKmT0rVc/mqdefault.jpg,BT,azttKmT0rVc,Intro To Persuasive Text using TV commercials,Persuasion
https://i.ytimg.com/vi/7ZGrIffrNdY/mqdefault.jpg,Error UnknownGT,7ZGrIffrNdY,Oblivion - How to Do The Disposition/Persuasion Minigame,Persuasion
https://i.ytimg.com/vi/qm9rqa0kKlA/mqdefault.jpg,TheSteezy22,qm9rqa0kKlA,Persuasive Speech~ Drink more water!,Persuasion
https://i.ytimg.com/vi/TmRLQFMm43s/mqdefault.jpg,itaspeech,TmRLQFMm43s,How to Be Persuasive,Persuasion
https://i.ytimg.com/vi/7ri5-rn_Kv0/mqdefault.jpg,quest0,7ri5-rn_Kv0,Fallout 4   How to Win Every Persuasion Attempt,Persuasion
https://i.ytimg.com/vi/ZxbjYOFoSeg/mqdefault.jpg,B Leon,ZxbjYOFoSeg,The Convincing Persuader How to convince influence persuade and communicate Persuasion persuasive nl,Persuasion
https://i.ytimg.com/vi/b3rwXOfUBa8/mqdefault.jpg,Videojug,b3rwXOfUBa8,How To Write A Letter Of Persuasion,Persuasion
https://i.ytimg.com/vi/48wnL56ytnE/mqdefault.jpg,scottbellconsultant,48wnL56ytnE,PERSUASION VS INFLUENCE what is the difference for experts - how to sell more  - Scott Sylvan Bell,Persuasion
https://i.ytimg.com/vi/dgrDjED8JI8/mqdefault.jpg,TeachSales2Me,dgrDjED8JI8,Persuasion Techniques. How to get more people to say Yes to your request,Persuasion
https://i.ytimg.com/vi/sJ7u30OG7yk/mqdefault.jpg,pwatts11,sJ7u30OG7yk,Elements of a Persuasive Argument,Persuasion
https://i.ytimg.com/vi/jtDFm27Ds5U/mqdefault.jpg,M. White,jtDFm27Ds5U,Banned Methods Of Persuasion How To Covertly Convince Influence Persuade And Negotiate With Anyone T,Persuasion
https://i.ytimg.com/vi/hqn4azeHikc/mqdefault.jpg,MindToolsVideos,hqn4azeHikc,Win-Win Negotiation: Learn how to Negotiate Effectively Without Damaging Relationships,Negotiation
https://i.ytimg.com/vi/aYvGYG82MSM/mqdefault.jpg,Brian Tracy,aYvGYG82MSM,How to Negotiate The Highest Salary,Negotiation
https://i.ytimg.com/vi/ZAbaCrVR4Y4/mqdefault.jpg,expertvillage,ZAbaCrVR4Y4,How to Negotiate a Contract : Negotiation Tips & Tactics,Negotiation
https://i.ytimg.com/vi/er2km7Aja1o/mqdefault.jpg,eHow,er2km7Aja1o,Human Resources : How to Negotiate Salary During Job Offer,Negotiation
https://i.ytimg.com/vi/lE5ko4ZeC_Y/mqdefault.jpg,SelfScore Inc.,lE5ko4ZeC_Y,How to Win a Negotiation,Negotiation
https://i.ytimg.com/vi/0chDCA5sZLw/mqdefault.jpg,Bishal SarkarTV,0chDCA5sZLw,How to Negotiate Like a Pro- Negotiate Business Deals| Negotiation Skills Video,Negotiation
https://i.ytimg.com/vi/VPOHfCdGFdc/mqdefault.jpg,Howcast,VPOHfCdGFdc,How to Negotiate When Buying a Car,Negotiation
https://i.ytimg.com/vi/FRw80DKyJsY/mqdefault.jpg,ramitsethi,FRw80DKyJsY,"Ask Ramit: How to use ""Competence Triggers"" in a salary negotiation",Negotiation
https://i.ytimg.com/vi/nov4DDgMN1g/mqdefault.jpg,Howcast,nov4DDgMN1g,How to Negotiate an Apartment Lease,Negotiation
https://i.ytimg.com/vi/_k2iG_JUPoM/mqdefault.jpg,Don Georgevich,_k2iG_JUPoM,How to get more money from job offers - secret salary negotiation tips,Negotiation
https://i.ytimg.com/vi/I2Fx5WcAa7U/mqdefault.jpg,expertvillage,I2Fx5WcAa7U,How to Negotiate a Contract : Contract Negotiation Planning Tips,Negotiation
https://i.ytimg.com/vi/5wMfwjYuGB0/mqdefault.jpg,Videojug,5wMfwjYuGB0,How To Discuss With A Car Salesman,Negotiation
https://i.ytimg.com/vi/RUWqfWwUPko/mqdefault.jpg,FormavisionEurope,RUWqfWwUPko,DBIF06.01.wmv - Business to Business Negotiation Example,Negotiation
https://i.ytimg.com/vi/KUBiIX_TVC0/mqdefault.jpg,expertvillage,KUBiIX_TVC0,How to Negotiate a Contract : Argument Erosion Negotiation Tips,Negotiation
https://i.ytimg.com/vi/GNjFSnvr8qI/mqdefault.jpg,Career Confidential,GNjFSnvr8qI,Discussing money (salary negotiations) in the job interview - get hired today!,Negotiation
https://i.ytimg.com/vi/OZPUrlcC3U0/mqdefault.jpg,James Robbins,OZPUrlcC3U0,How to Motivate Your Staff,Motivating
https://i.ytimg.com/vi/pZT-FZqfxZA/mqdefault.jpg,AsapSCIENCE,pZT-FZqfxZA,The Science Of Motivation,Motivating
https://i.ytimg.com/vi/H9LSopkLbpw/mqdefault.jpg,Kellogg School of Management,H9LSopkLbpw,How to keep your team motivated,Motivating
https://i.ytimg.com/vi/_GiuysFb-iY/mqdefault.jpg,Armando Rodriguez,_GiuysFb-iY,10 WAYS TO MOTIVATE EMPLOYEES,Motivating
https://i.ytimg.com/vi/1ybksrCEELU/mqdefault.jpg,Michael Spremulli,1ybksrCEELU,How to Motivate Employees Using the 6 Hidden Motivators,Motivating
https://i.ytimg.com/vi/yVz_Ku1_FQE/mqdefault.jpg,Redshoesandberets,yVz_Ku1_FQE,MOTIVATION TO STUDY- students must watch!,Motivating
https://i.ytimg.com/vi/ln9yN8aGQFM/mqdefault.jpg,Kids In The House,ln9yN8aGQFM,"How To Motivate Your Child - Lee Hausner, PhD",Motivating
https://i.ytimg.com/vi/NVjfSujjnaw/mqdefault.jpg,Mark Sanborn,NVjfSujjnaw,How to Motivate Others | Mark Sanborn Leadership Speaker,Motivating
